0	阅读古诗，回答问题。	1	语文题库	1
2	一些不成功的作家也在描写现实，可他们笔下的现实说穿了只是一个环境，是固定的，死去的现实，他们看不到人是怎样走过来的，也看不到怎样走去。	3	余华_活着	1
0	医生喊：快送进来，病人心跳都快没啦。	3	余华_活着	1
4	就为了留下一条根，绵绵不绝的根。	2	乡居笔记_周同宾	1
0	她的最简短，也最有概括性。	3	三体_刘慈欣	1
1	在这个大兴安岭深处的小山村里，叶文洁心中的什么东西渐渐融化了，在她心灵的冰原上，融出了小小的一汪清澈的湖泊。	3	三体_刘慈欣	1
4	那是一种使人一旦闻到便不能作罢的气味，使人闻之便立即解脱一切心事沉疳而飘飘欲仙起来。	3	白鹿原_陈忠实	1
2	任何人，不管好人、坏人都有父母，在父母眼中都很可爱，老鼠在父母眼中可能是可爱的孩子呢！	2	林清玄	1
1	遥望洞庭山水翠，白银盘里一青螺。	1	语文题库	1
0	我对自己说，任凭爹怎么揍我，我也不要还手。	3	余华_活着	1
0	他又推推老全，老全没说话。	3	余华_活着	1
0	她又露出那动人的笑。	3	三体_刘慈欣	1
4	他说这句话时，周围还是熟悉的一切，拉下的窗帘上摇曳着夏天的树影：但在所有与会者眼中，这个世界已经不同于以往了，他们感觉到了一双无所不在的眼睛盯着自己，在这双眼睛下，这个世界已经无处躲藏。	3	三体_刘慈欣	1
11	平静的树都能唤起我们的感思之心，何况是翩翩的彩蝶、凌空的飞鸟，以及那些相约而再来的人呢？	2	林清玄	1
0	是的，我以前受你欺骗，你用自己那反动的世界观和科学观蒙蔽了我!	3	三体_刘慈欣	1
10	假如你洗头用达尔美，那你只能得到一头乌黑的头发，却要失去那么多头屑和灰尘，所以在买之前，你一定要三思啊！	0	-	1
0	后来，我们看到了连长，他换上老百姓的衣服，腰里绑满了钞票，提着个包裹向西走去。	3	余华_活着	1
6	浮云富贵，粪土王侯。	2	-	2
2	我不开灯，又沉默地站在窗前，看暗夜渐渐织上天空，织上对面的屋顶。	1	语文题库	1
0	得知消息后，恐惧压倒了一切，他决定牺牲叶文洁，保护自己。	3	三体_刘慈欣	1
0	大王，我们只有一千人，他们却有十万……	0	-	1
0	家珍端着一大盆衣服从池塘边走上来，遇到了跑来的王喜，王喜说：少奶奶，老爷像是熟了。	3	余华_活着	1
0	我娘和家珍听到响声从屋里出来，家珍叫了声：爹。	3	余华_活着	1
2	我就这样进入梦乡，三球在梦中一直舞蹈着，无规律的永不重复的舞蹈。	3	三体_刘慈欣	1
0	如果地球上的每一样生物都不会灭绝，那这个世界必定非常混乱。	2	林清玄	1
0	我实在是舍不得我心中那一只小小的燕子啊！	2	燕子_席慕蓉	1
0	我只是感到和她在一起身心愉快，也不去考虑以后会是怎样。	3	余华_活着	1
0	那天下午在良湘的工地上，一次短暂的休息中，他突然被眼前的一幅构图吸引了。	3	三体_刘慈欣	1
8	黄土高原上，沙子跳着场多么壮阔，多么豪放，多么火烈的舞蹈啊！	0	-	1
0	看看银元我有些心疼，那可是家珍从城里带来的，只剩下这两块了。	3	余华_活着	1
0	喊了几下后，老全还是那么一副样子，我才想完了，老全出事了。	3	余华_活着	1
0	我喜欢喝农民那种带有苦味的茶水，他们的茶桶就放在田埂的树下，我毫无顾忌地拿起漆满茶垢的茶碗舀水喝，还把自己的水壶灌满，与田里干活的男人说上几句废话，在姑娘因我而起的窃窃私笑里扬长而去。	3	余华_活着	1
1	她的脸红得像果园里成熟的苹果！	0	-	2
9	帝国主义和我们，除了它的奴才之外，哪一样厉害不和我们正相反？我们的痈疽，是它们的宝贝，那么，它们的敌人，当然是我们的朋友了。	0	-	1
4	老松树高耸入云。	1	语文题库	1
4	在如此危险的城市，社会、时代，我们每一天的活着都是奇迹，我们应该感谢这个奇迹，在内心维持和平、宁静与喜悦。	2	林清玄	1
0	那次我实实在在地把我丈人的脸丢尽了，我丈人当时傻站在那里，嘴唇一个劲地哆嗦，半晌才沙哑地说一声：祖宗，你快走吧。	3	余华_活着	1
1	就像我在加拿大的那些日子，几乎天天部看到乌鸦，愈看愈发现乌鸦很好看，声音也很好听，飞起来也很优美，一副吉祥的样子，好像穿黑礼服的绅士。	2	林清玄	1
4	他纵身一跳，一跃而起，上了三楼。	0	-	1
0	家珍把手帕叠得整整齐齐重新塞到褥子底下，给我拿出一身干净衣服，让我换上。	3	余华_活着	1
1	他很快知道那不是出汗，这人身体内的水分正在被彻底排出，这些水在沙地上形成了几条小小的溪流，追随者的整个躯体如一根熔化的蜡烛在变软变薄……	3	三体_刘慈欣	1
0	沐浴在春天的气息里，所有人都中心地赞美太阳、赞美掌管宇宙的诸神。	3	三体_刘慈欣	1
1	绿树照映着俊俏的身影，构成一幅美丽动人的图画。	1	语文题库	1
0	我站着没有动，我哪敢过去。	3	余华_活着	1
2	他腿上沾满了泥巴，刮光了的脑袋上稀稀疏疏地钻出来些许白发，胸前的皮肤皱成一条一条，汗水在那里起伏着流下来。	3	余华_活着	1
11	海边上不是还泛着白色的浪花吗？	0	-	1
0	他以为变乱了人类的语言就可以使人类彼此不能理解，他忘记了同一种语言的人也可以互不理解。	2	理解_马莉	1
1	完成时犹如一壁炉上小装饰。	2	生命__沈从文	1
0	这是因为他缺乏良好的自我教育，弄得原来的主旋律遭了掩蔽。	2	人生像一首诗__林语堂	1
7	总想为朋友在春季送上一束散逸着淡淡清香的花，在盛夏送上一杯甘之如饴的泉水，在深秋送上一片着意采摘的枫叶，在寒冬送上一份相属相知的问候……	2	三喜临门_一郎	1
0	鹿三双手按着铡把，猫腰往下一压，「吁嚓」一声，被铡断的细草散落下来，铡刀刃上和铡口的铁皮士都染上一层青草的绿汁。	3	白鹿原_陈忠实	1
0	一张没有经过什么风吹日晒的脸，流满了汗道道，他只好不时把头上一顶肮脏的破呢帽揭下来，揩一把脸；揩完了再戴到头上。	3	平凡的世界_路遥	1
2	以前，汪淼总觉得自己的摄影作品缺少某种灵魂；现在他知道了，缺的是她。	3	三体_刘慈欣	1
0	老天不是无眼，而是知道爱情变化无常，我们的誓言在智者的耳中不过是戏言罢了。	2	林清玄	1
0	我一听这话头皮阵阵发麻，他是拉我当壮丁的。	3	余华_活着	1
0	田福贤说：嘉轩，赶快敲锣！	3	白鹿原_陈忠实	1
0	你们三个都是身强体壮而又智慧过人的好孩子，现在，请你们尽其可能的去攀登那座我们一向奉为神圣的大山。	2	敬畏生命（外一则）_张晓风	1
0	龙二和另两个债主就拿出帐簿，一五一十给我算起来，龙二拍拍我凑过去的脑袋，对我说：少爷，看清楚了吗？	3	余华_活着	1
9	人追随情欲而在生死时空中飞翔，与一只蜜蜂飞来寻找一朵花也没有什么不同！	2	林清玄	1
6	相分吃有春，相抢吃无份。	2	林清玄	1
9	有缺点的战士终究是战士，完美的苍蝇也终究不过是苍蝇。	0	-	1
0	沉没于地平线下，下沉的过程很快，大地似乎又沿着那堵光墙升起。	3	三体_刘慈欣	1
0	下一次‘飞星不动'会怎样？	3	三体_刘慈欣	1
2	打倒一切反动学说!	3	三体_刘慈欣	1
2	最令人惊奇的是这骷髅站立着，那姿势很是优雅高贵，一只手抬到颚下，似乎在抚摸着那已不存在的胡须，它的头微仰，仿佛在向天地发问。	3	三体_刘慈欣	1
7	那微笑，有时让人觉得舒畅温柔，有时让人觉得略含哀伤，有时让人觉得十分亲切，有时又让人觉得有几分矜持。	1	语文题库	1
0	在漫长的科学发展史上，物理学家们用加速器撞击过多少质子？	3	三体_刘慈欣	1
0	不不，你拿去，人工种植的，不是什么珍贵的东西，我血压高，根本用不着的。	3	三体_刘慈欣	1
8	有人看到了我，就嘻嘻笑着喊：来啦，来啦。	3	余华_活着	1
0	还有你。	3	余华_活着	1
4	少女两手同时快速松开，好像那个头颅发烫似的。	3	三体_刘慈欣	1
0	亚里士多德狞笑着，掏出一个银色的Zippo打火机，耍了一个复杂的把戏，锵的一声打着了火。	3	三体_刘慈欣	1
8	走着走着，不觉有东西掉在脸上，这才知道，下雨了。	0	-	1
2	作者试图讲述一部在光年尺度上重新演绎的中国现代史，讲述一个文明二百次毁灭与重生的传奇。	3	三体_刘慈欣	1
0	倒是另一个债主亲热些，他拍拍我的肩说：福贵，去喝一壶。	3	余华_活着	1
5	月夜,清冷的月光铺满一地,淡淡的光辉似乎带有一种清冷的香味,而且可以感觉到那质地还是相当的光滑.	0	-	2
2	阵阵春风，吹散云雾，太阳欣然露出笑脸，把温暖和光辉洒满湖面。	0	-	1
1	少年时代的读书生活恰似一幅流光溢彩的画页，也似一阕跳跃着欢快音符的乐章。	1	语文题库	1
0	不过，这确实没什么要紧的，只要你习惯了忽略视野里的那些杂物，对视力没什么影响。	3	三体_刘慈欣	1
0	离开老人的渔港很多年了，这些年偶尔路过渔港，就会浮起老人的脸；偶尔收听到渔业气象，我会静心地听，想起老人那专注，充满关怀与爱的神情。	2	林清玄	1
0	这本来应该是一本很普通的书，主题并不广阔，只是描述杀虫剂的滥用对环境造成的危害，但作者的视角对叶文洁产生了巨大的震撼：蕾切尔．卡逊所描写的人类行为——使用杀虫剂，在文洁看来只是一项正当和正常的、至少是中性的行为；而本书让她看到，从整个大自然的视角看，这个行为与文化大革命是没有区别的，对我们的世界产生的损害同样严重。	3	三体_刘慈欣	1
0	他看到了我的肩膀，又说：肩膀也磨破了。	3	余华_活着	1
8	求求你了，救一救孩子们吧！救一救孩子们吧！	0	-	1
9	我懂得一朵花打扮不出春天来，只有百花齐放才能春色满园的道理。	0	-	1
0	他们对自己的经历缺乏热情，仿佛是道听途说般地只记得零星几点，即便是这零星几点也都是自身之外的记忆，用一、两句话表达了他们所认为的一切。	3	余华_活着	1
1	澎湃的海涛似千军万马涌向海滩。	1	语文题库	1
2	秋便以翩跹之姿踏碎了夏天的流言。	0	-	1
0	凤霞转过身去看一看说：是奶奶。	3	余华_活着	1
0	汪淼站在一个稍高些的小丘上向下看，这密密的人海一望无际，汪淼大致估计了一下数量，仅目力所及的范围就可能有几亿人！	3	三体_刘慈欣	1
0	严防阶级敌人破坏捣乱！	3	平凡的世界_路遥	1
0	前沿的枪炮声越来越紧，也不分白天和晚上。	3	余华_活着	1
11	我们没有文学没有艺术，没有对美的追求和享受，甚至连爱情也不能倾诉——元首，这样的生活有意义吗？	3	三体_刘慈欣	1
1	像照穿鸡蛋壳一般照穿了内壳，我们就看到了太阳。	3	三体_刘慈欣	1
0	第二天一早，我刚起床就看到四个人进了我家院子，走在头里的是个穿绸衣的有钱人，他朝身后穿粗布衣服的三个挑夫摆摆手说：放下吧。	3	余华_活着	1
6	明智者若善用其明智，即可从此云空中，读示一小文，文中有微叹与沉默，色与香，爱和怨。	2	生命__沈从文	1
11	莫愁前路无知己，天下谁人不识君？	1	语文题库	1
0	不知是哪一天，她走过来的时候，看了他一眼。	3	平凡的世界_路遥	1
1	他霎时间是个自由自在的身子，无论他是靠在沙发上的绅士，还是蹲在台阶上的瓦匠。	2	谈抽烟_朱自清	1
0	家珍把我拉到一旁说：你去城里请个郎中来。	3	余华_活着	1
1	但这一切都没有用，我们的家园仍在冤冤相报的泥潭中越陷越深。	3	三体_刘慈欣	1
0	城市的四面八方，灯火已经闪闪烁烁。	3	平凡的世界_路遥	1
1	我们盘腿坐在土炕上，就像坐在船上。	1	语文题库	1
1	太阳在西天缓缓下落，叶文浩不得不手动跟踪．这时．红岸天线像一棵巨大的向日葵，面对着下落中的太阳缓缓转动。	3	三体_刘慈欣	1
2	犁田的老牛或许已经深感疲倦，它低头伫立在那里，后面赤裸着脊背扶犁的老人，对老牛的消极态度似乎不满，我听到他嗓音响亮地对牛说道：做牛耕田，做狗看家，做和尚化缘，做鸡报晓，做女人织布，哪只牛不耕田？	3	余华_活着	1
1	书，被人们称为人类文明的长生果。	1	语文题库	1
0	作家的使命不是发泄，不是控诉或者揭露，他应该向人们展示高尚。	3	余华_活着	1
4	她看见神用名为痛苦的刃，切下她硕果仅存的理性，再蛮不在乎地吃掉它，神的嘴边流出血样的果汁。	3	房思琪的初恋乐园_林奕含	1
0	为了家珍她们，我对自己说：我就不报恩了，我记得解放军的好。	3	余华_活着	1
2	文明的种子仍在。	3	三体_刘慈欣	1
3	圆规一面愤愤的回转身，一面絮絮的说，慢慢向外走去。	0	-	1
9	清凉的也好，混浊的也好，清凉的洗涤了我在红尘中灰尘满布的心灵；混浊的琢磨了我那些粗糙的砂粒，使那内在的钻石发出光芒！	2	林清玄	1
1	蒲公英有一蓬金黄色的头发，当起风的时候，头发互相轻触着，像磨砂纸那样沙沙地一阵细响，转眼间，它的头发，全被风儿梳掉了。	0	-	1
4	狂风呼啸，长江掀起万丈狂澜。	1	语文题库	1
0	从古到今，世界说来说去，总是识字人的天下。	3	平凡的世界_路遥	1
0	这太阳就是银色的，与老人头发一样的颜色，它将一片银光撒向大地，但汪淼从这光芒中感觉不到一点儿暖意。	3	三体_刘慈欣	1
0	那人说：姓徐呀。	3	余华_活着	1
11	不出名我如何引导人们的思想?	3	三体_刘慈欣	1
4	我端起搪瓷碗，觉得这个碗有千斤重，怎么也送不到嘴边。	1	语文题库	1
1	我的萌芽、生长，无不沐浴着老师的阳光雨露。	1	语文题库	1
11	他说：而且那些俗人懂得什么叫古董？	2	把时间花在心灵上__林清玄	1
0	写作过程让我明白，人是为活着本身而活着的，而不是为活着之外的任何事物所活着。	3	余华_活着	1
7	友谊之链不可继承，不可转让，不可贴上封条保存起来而不腐烂，不可冷冻在冰箱里永远新鲜。	2	友情：这棵树上只有一个果子，叫做信任_毕淑敏	1
5	熊的叫声洪亮，像铁锤一样撞击着我的耳膜。	0	-	2
7	我是个小人物，生活在社会的最底层，没有人会注意到我，孤独一生，没有财富没有地位没有爱情，也没有希望。	3	三体_刘慈欣	1
11	每个人的人格、信念、思想，不就是他自己的佛堂吗？	2	林清玄	1
0	在那种情况下我比你要安全得多，你应该知道，一个人的鉴别能力是和他的知识成正比的。	3	三体_刘慈欣	1
0	我对他说了一个寓言：从前有一个人，用水缸养了一条最名贵的金鱼。	2	林清玄	1
0	秘书长庄严宣布：单摆启动！	3	三体_刘慈欣	1
0	与西方那些旨在回归自然的乌托邦社团不同，他的中华田园不是处于荒野之地，而是置身于最大的城市中。	3	三体_刘慈欣	1
0	在哭咽河上，有一座几步就能跨过的小桥。	3	平凡的世界_路遥	1
0	汪淼抬头望去，发现星空发生了不可息议的变化：群星竟然排成了一个严整的正方形阵列！	3	三体_刘慈欣	1
2	经过翻新以後，一座完整的四合院便以其惹人的雄姿稳稳地盘踞於白鹿村村巷里。	3	白鹿原_陈忠实	1
0	说完，他看看我，问我爹：这位是少爷吧？	3	余华_活着	1
0	凤霞高兴的样子叫我看了难受，我对她说：凤霞，你过来。	3	余华_活着	1
0	王喜将我爹的身体翻了翻，摸出一块拳头大的石头扔到一旁，我爹重又斜躺在那里，轻声说：这下舒服了。	3	余华_活着	1
1	眯起眼睛四顾，满屋子亮晶晶的宝石就像是四壁的橱窗里都住着小精灵在眨眼睛。	3	房思琪的初恋乐园_林奕含	1
2	那点薄雪好像忽然害了羞，微微露出点粉色。	0	-	1
0	我老了，挑不动担子了，你就自己挑着钱去还债吧。	3	余华_活着	1
7	它的开始就是天真烂漫的童年时候，接着便是粗拙的青春时期，粗拙地企图去适应成熟的社会，具有青年的热情和愚憨，理想和野心；后来达到一个活动很剧烈的成年时期，由经验获得利益，又由社会及人类天性上得到更多的经验；到中年的时候，紧张才稍微减轻，性格圆熟了，像水果的成熟或好酒的醇熟那样地圆熟了，对于人生渐渐抱了一种较宽容，较玩世，同时也较慈和的态度；以后便到了衰老的时候，内分泌腺减少它们的活动，如果我们对老年有着一种真正的哲学观念，而照这种观念去调整我们的生活方式，那么，这个时期在我们心目中便是和平、稳定、闲逸和满足的时期；最后，生命的火光闪灭了，一个人永远长眠不再醒了。	2	人生像一首诗__林语堂	1
11	我千千万万个普通人，不是正是这样的野花吗？	0	-	1
0	那时候我儿子有庆还没出来，我女儿凤霞刚好四岁。	3	余华_活着	1
2	躺在温软雪白的草皮上，听雨──滴沥滴沥──在窗外，后院憔翠，斜墙有天梯，雨潺潺而流，在那儿最是回荡，流经处，把心曲留下。	2	雨夜的情调_草雪	1
11	这不就是病母吗？	2	林清玄	1
1	自在飞花轻似梦，无边丝雨细如愁。	1	语文题库	1
0	我们应该能够体验出这种人生的韵律之美，应该能够像欣赏大交响曲那样，欣赏人生的主要题旨，欣赏它的冲突的旋律，以及最后的决定。	2	人生像一首诗__林语堂	1
2	每天清晨，我都会在鸟儿们的歌声中睁开双眼，迎接新的一天。	0	-	1
4	他在巴掌大的房间里演算着习题。	1	语文题库	1
0	走回来时有庆脸都涨红了，那是高兴的。	3	余华_活着	1
7	有喜有忧，有笑有泪，有花有草，有香有色，这就是养花的乐趣。	1	语文题库	1
7	我赞美泰山的雄伟；歌颂黄山的浪漫；感叹恒山的美丽，我对山的感觉无法用言语轻易表达。	0	-	1
2	一颗有生命力的种子，如果不落在肥土里，而落在瓦砾堆里，他决不会悲观，决不会叹气。	1	语文题库	1
2	这时候，一只蜜蜂从阳光里穿行而来，它几乎毫不犹豫的，就停在那一朵朱槿花上，那样投入、专注而忘情地吸着花蜜。	2	林清玄	1
0	困难，折磨，痛苦是多么珍贵！	2	林清玄	1
8	时间急促地呼吸，啊，慢慢伛偻，慢慢鬓发稀疏，慢慢成老朽，猛想起作为，浑身痛楚。	2	繁花结出沉甸甸的遗憾_李发模	1
0	人要是累得整天没力气，就不会去乱想了。	3	余华_活着	1
1	如果说向她飞来的球像一团熊熊燃烧的烈火，那么，从她手里飞走的球袅青烟……	1	语文题库	1
5	海在我们脚下沉吟着﹐诗人一般。那声音仿佛是朦胧的月光和玫瑰的晨雾那样温柔﹔又像是情人的蜜语那样芳醇﹔低低地﹐轻轻地﹐像微风度拂过琴弦﹔像落花飘零在水上。	2	听潮_鲁彦	2
0	在别人的本领之前，你显示自己的渺小吧。	2	伟大与渺小__臧克家	1
6	一群客人挤在客厅里，谁也不肯先坐，谁也不肯坐首座，好像常常登上座，渐渐入祠堂的道理是人人所不能忘的。	2	话说谦让__梁实秋	1
0	我把担子放在他跟前，他揭开瓜叶时皱皱眉，对我说：你这不是自找苦吃，换些银元多省事。	3	余华_活着	1
0	我心想就是嘛，他自己干不了的事硬要我来干，我怎么会答应。	3	余华_活着	1
0	我说：去你娘的。	3	余华_活着	1
0	我多么想把老人的脸容与神情描写给人知道，可惜的是，充满爱的脸是文字所难以形容的。	2	林清玄	1
1	索溪像一个从深山中蹦跳而出的野孩子，一会儿绕着山奔跑，一会儿撅着屁股，赌着气又自个儿闹去了。	1	语文题库	1
0	她首先面临的．是一种奉献目标的缺失．她曾是一个理想主义者，需要将自己的才华贡献给一个伟大的目标。	3	三体_刘慈欣	1
0	我一动不动地看着她，凤霞就过来拉我的手，拉不动我她就哭了。	3	余华_活着	1
7	善者的面具是白色的，白色代表纯洁；国王的面具是红色的，红色代表威严，王妃的面具是绿的，绿色代表柔顺；活佛的面具是黄色的，黄色代表吉祥。	1	语文题库	1
0	那四样菜都是蔬菜，家珍做得各不相同，可吃到下面都是一块差不多大小的猪肉。	3	余华_活着	1
0	没人抢米了，我们三个人去扛了几袋米回来，铺在坑道当睡觉的床，这样躺着就不怕子弹硌得身体难受了。	3	余华_活着	1
1	我们是顽强的种子．野火烧不尽的!	3	三体_刘慈欣	1
2	欢喜或忧惧强迫着人去计划，布置；还是二十四小时一天，可是这些天与往常不同，它们不许任何人随便的度过，必定要作些什么，而且都得朝着年节去作，好象时间忽然有了知觉，有了感情，使人们随着它思索，随着它忙碌。	3	骆驼祥子_老舍	1
0	昨天吃过的荷兰豆？	3	三体_刘慈欣	1
1	远处的大地上，星罗棋布着许多显然是干仓的高大建筑，都有着全反射的镜面表面，在晨光中像大地上生长的巨型水晶植物。	3	三体_刘慈欣	1
7	曾几何时，您的头发变白了，是您的年轻换来了我的健康成长；曾几何时，您的脸爬满皱纹，是您的汗水浇灌了我的幸福生活；曾几何时，您的背变弯曲了，是您的臂膀承担了我的衣食住行。	0	-	1
0	到了秋天，在那几乎看不到泥土的细缝里，竟然长出一丛丛三四尺高的小白花来。	2	水泥地上的野花_含笑看我	1
1	粥是用各种米，各种豆，与各种干果熬成的。这不是粥，而是小型的农业展览会。	1	语文题库	1
0	每座单摆都在摇动中。	3	三体_刘慈欣	1
8	近咸阳，过宫墙；过宫墙，绕回廊；绕回廊，近椒房；近椒房，月黄昏；月黄昏，夜生凉；夜生凉，泣寒巷；泣寒巷，绿纱窗；绿纱窗，不思量！	0	-	1
2	有些贝类自己不动，巴在轮船底下做免费的长途旅行。	1	语文题库	1
0	但也在进行更加先进的无线电数码传递试验，由于技术不成熟，传送频率较低，所以信息泄漏较大，能被红岸系统接收到。	3	三体_刘慈欣	1
1	马克思主义的方法就是政治上军事上的望远镜和显微镜。	0	-	1
1	像针尖上一滴水滴在大海里，我的日子滴在时间的流里，没有声音，也没有影子。	1	语文题库	1
0	福贵说到这里看着我嘿嘿笑了，这位四十年前的浪子，如今赤裸着胸膛坐在青草上，阳光从树叶的缝隙里照射下来，照在他眯缝的眼睛上。	3	余华_活着	1
1	好端端的一个家成了砸破了的瓦罐似的四分五裂。	3	余华_活着	1
0	两个美国人在调试一个高精度卫星接收天线时意外地发现了宇宙背景辐射……	3	三体_刘慈欣	1
0	只想坐坐，看看夕阳，不说什么。	2	音乐是一种心境_　　音乐是一种心境。	1
0	开始我以为她是随意为之，但问她感受时，这孩子说：她看到一个巨人在大地上搭一座好大好复杂的房子，巨人一点一点地搭着，乐曲完了，大房子也就搭完了……	3	三体_刘慈欣	1
0	在叶文洁读天体物理专业研究生的两年里，再到后来停课闹革命至今，阮老师一直是她除父亲外最亲近的人。	3	三体_刘慈欣	1
0	就职的主教照例地当众谦逊三回，口说nolocpiscopari，意即我不要当主教，然后照例地敦促三回，终于勉为其难了。	2	话说谦让__梁实秋	1
2	汪淼绕过了大厦，来到它后面，立刻看到了一件不可思议的东西：一架顶天立地的巨型单摆。	3	三体_刘慈欣	1
2	褐蚁感到了地面的震动，从震动由弱变强的趋势来判断，它知道地面上的另一个巨大的存在正在向这里运动，它没有理会，继续向孤峰上攀爬。	3	三体_刘慈欣	1
0	有一次我正割着稻子，凤霞跟在后面捡稻穗，龙二一摇一摆走过来，对我说：福贵，我收山啦，往后再也不去赌啦。	3	余华_活着	1
7	我祝愿奥运精神永驻人间，给世界带来和平、带来欢乐、带来繁荣、带来希望。	1	语文题库	1
4	整个礼堂挤得连根针也插不下。	0	-	2
1	待到第二天清晨倏地想起，急急推门出户，那已经绽放过的花朵，一如垂头敛翼的凤凰，倦然冷冷的不见一丝神采。	2	错过_郭丽华	1
0	会议室里的A君独自一人，无所事事。	2	恋爱的艺术_《自然与人》	1
11	难道还有比这更好的办法吗？	0	-	2
0	老全没答理我们，继续看来看去。	3	余华_活着	1
