7	每次数学课改考卷，思琪盯着助教念ABCD，A是命令，B是脏话，C是嘘了要她安静，D是满足的微笑。	3	房思琪的初恋乐园_林奕含	1
4	叶文洁不知道材料上那些内容是真是假，但可以肯定，上面的每一个标点符号都具有致命的政治杀伤力。	3	三体_刘慈欣	1
6	苏东坡有两句诗：一年好景君须记，正是橙黄橘绿时。	2	林清玄	1
6	大水流为九曲，春风又是一年。	0	-	1
6	三个臭皮匠，胜过诸葛亮。	0	-	1
0	这首歌深深打动了我，我决定写下一篇这样的小说，就是这篇《活着》，写人对苦难的承受能力，对世界乐观的态度。	3	余华_活着	1
4	九万里雷霆，八千里风暴，劈不歪，砍不动，轰不倒！	1	语文题库	1
9	阳奉阴违，口是心非，当面说的好听，背后又在捣鬼，这就是两面派的行为。	0	-	1
1	那位被检举者待人接物的势利现实，一如阳光下的融雪，终至底层裸露，让人看清楚。	2	把一切交给时间_储子	1
6	青年诗人殷夫将它译为：生命诚可贵，爱情价更高。	2	译诗漫谈_王若谷	1
7	我们的生命如此短暂，有所营谋，必有所烦恼；有所执著，必有所束缚；有所得，必有所失。	2	把时间花在心灵上__林清玄	1
0	我们看到街上那些智障或者智力比较差的人，他们是非常单纯，非常纯净的。	2	林清玄	1
0	铜钱上盖着的南瓜叶是我娘和家珍去采的，凤霞看到了也去采，她挑最大的采了两张，盖在担子上，我把担子挑起来准备走，凤霞不知道我是去还债，仰着脸问：爹，你是不是又要好几天不回家了？	3	余华_活着	1
1	他脑袋垂着，眼睛却跟钉子似的钉在龙二那双手上。	3	余华_活着	1
0	当我们鲜红的血液还能流动与运转，就以感谢的心来为社豁做一点什么吧！	2	林清玄	1
0	连长都不知道我们到了什么地方，村里人跑了个精光，我望望四周，除了光秃秃的树和一些茅屋，什么都没有。	3	余华_活着	1
0	这样想着，使我因悲哀而感到心酸，类似这样的画面，在这个城市却每天都在发生。	2	林清玄	1
3	红领巾在车站宣传卫生。	0	-	1
2	泉水绕过树根，拍打卵石，穿越草丛，流连花间……	1	语文题库	1
1	浅绿色的树皮上嵌着淡黄色的花纹，像一匹匹光滑的绸缎。	1	语文题库	1
4	广场上人山人海。	1	语文题库	1
0	希望你们不要听信他们的谎言，站在正义的一方，站在革命的一方！	3	三体_刘慈欣	1
0	我放下了手，悬着的心也放下了。	3	余华_活着	1
3	白胡子摇头晃脑，在讲台上自顾自说着书，底下的学生心早就飘到了窗外。	0	-	1
5	她的声音犹如棉花糖一样甘甜,犹如婴儿的棉肚兜一样柔软。	0	-	2
0	他身材瘦高，身着飘逸的黑色长袍，长发在头顶上不经意地缩了个结，剩下的在风中飞扬。	3	三体_刘慈欣	1
0	这天开始，我就挑着铜钱走十多里路进城去还债。	3	余华_活着	1
2	我的写作，不只是在告诉人关于这人间的美丽，而是在唤起一些沉睡着的美丽的心。	2	林清玄	1
0	当它的舰首接触两根钢技之间似乎空无一物的平面时，汪淼头皮一紧，但什么都没有发生，巨轮庞大的船体从两根钢技间徐徐驶过。	3	三体_刘慈欣	1
0	为他们插进了联考的巨大空虚干杯。	3	房思琪的初恋乐园_林奕含	1
11	这不是自取灭亡吗?	3	三体_刘慈欣	1
0	我满身泥土走上了家乡的路，后来我看到了自己的村庄，一点都没变，我一眼就看到了，我急冲冲往前走。	3	余华_活着	1
11	怎么会不知道呢?	3	三体_刘慈欣	1
3	不拿群众一针一线。	0	-	2
0	爹坐下后问我：债还清了？	3	余华_活着	1
0	我丈人使劲跺了下脚说：还不快去。	3	余华_活着	1
0	我看了看她，看了看自己，然后笑了：一路小心。	2	非走不可的弯路__张爱玲	1
0	他们干得很从容，甚至看上去有些懒洋洋的，像是在从事一件平淡乏味的工作。	3	三体_刘慈欣	1
2	街道两旁尽是黑色的瓦砾，烧焦的树木垂头丧气地弯着腰。	1	语文题库	1
0	有个老兵想想前面的弟兄流血送命，我们老闲着也不是个办法，他就去问连长：我们是不是也打几炮？	3	余华_活着	1
0	她和孩子们站在一片修剪得很好的绿草坪上，上面有几只白色的小动物。	3	三体_刘慈欣	1
1	长官向我们两个挥挥手说：两头蠢驴，打架都不会，给我去拉大炮。	3	余华_活着	1
0	汪淼环顾四周，看到了冯·诺伊曼和秦始皇，冯·诺伊曼在飘浮中对秦始皇大声说着什么，但没有声音发出，只出现了一行小小的字幕：……	3	三体_刘慈欣	1
0	我爹已不是走在自己的地产上了，两条腿哆嗦着走到村口，在粪缸前站住脚，四下里望了望，然后解开裤带，蹲了上去。	3	余华_活着	1
2	在蒙昧混沌的世界中，有这样的音乐渗入心灵，会怎么样呢？	2	莫扎特的造访_赵丽宏	1
11	居里夫人只要在专利书上签个字，所有的困难不是都可以解决了吗？	0	-	1
1	书籍是全世界的营养品。	1	语文题库	1
3	要是再敢乱说话，小心你的乌纱帽！	0	-	2
5	月光下，那低头思故乡的离愁，已被古老的潮水年复一年的打磨得光滑如许了，在湖边浅水里静泊成一叶沉思的小舟。	0	-	1
0	连长命令我们架起大炮，我知道这下是真要打仗了。	3	余华_活着	1
3	枪杆子里出政权。	0	-	1
3	竹竿生了病，所以才会那么瘦。	0	-	1
1	露似珍珠月似弓。	2	-	2
0	解放军让我回家，还给了盘缠。	3	余华_活着	1
1	耀眼的晚霞转瞬即逝，夜幕像被一双巨手拉扯的大黑布般遮盖了已化为灰烬的世界。	3	三体_刘慈欣	1
0	相思林的麻雀偶尔也会数只一群飞到窗前的庭院，跳来跳去，叫一叫，就呼啸过去了。	2	林清玄	1
2	只是，生命的悲情是，我们自以为比时间快一步，但岁月也很快地被时光掩埋。	2	林清玄	1
7	常常有一种喜欢留在心上，喜欢茶香在舌尖喉际回绕，喜欢和一二知己在桌上谈心，看咖啡在透明的壶内沸腾，喜欢突然接到一个电话，说他此刻送花来，请到某处相候……	2	喜欢_史长安	1
0	只有在这社会的大风大浪中，他才把饿肚子放在一边，精神上享受着一种无限的快活。	3	平凡的世界_路遥	1
1	飞机在上面一出现，下面的国军就跟蚂蚁似的密密麻麻地拥来拥去，扔下的一箱箱弹药没人要，全都往一袋袋大米上扑。	3	余华_活着	1
1	八千多日子已经从我手中溜去；像针尖上一滴水滴在大海里。	1	语文题库	1
0	那妓女嘟嘟哝哝背着我往城门走，说什么雷公不打睡觉人，才睡下就被我叫醒，说我心肠黑。	3	余华_活着	1
0	我过不去，在那里耽搁了几个月。	3	余华_活着	1
4	这座楼真高，坐电梯到了顶楼，发现云都在脚下。	0	-	1
4	我无论如何也不忍把姐姐病中的面貌加以描述，这于我是一种心灵上的刑罚；于读者，也无疑会因为一个不相识女子的美丽的陨丧，而有些颓丧的。	2	美丽人生_余志刚	1
2	树儿沐浴过春雨，褪去了枯黄的冬衣，为自己换上了嫩绿的新装。	0	-	1
0	这分别意味着什么？	3	三体_刘慈欣	1
9	记得在大三的一次信息课中，教授挂出了两幅大图片，一幅是画面庞杂精细的《清明上河图》，另一幅是一张空旷的天空照片，空荡荡的蓝天上只有一缕似有似无的白云。	3	三体_刘慈欣	1
2	他骄傲得尾巴都翘到天上去了。	0	-	1
0	我们把吃剩的果皮拿到树林或稻田，或甚至放在庭院的角落，到黄昏的时刻，就会有许多不知从何处赶来，闪着绿光、黄光和蓝光的金龟子，它们密密麻麻紧紧吸在果皮上，我们常常一口气就抓到几十只金龟子。	2	林清玄	1
0	而现在，独自坐在这儿，眼前是一汪碧绿的池水，望着对岸那棵尖尖的宝塔松，我出奇地安静了。	2	面对得到_曹明华	1
4	既然彼此已将对方铭刻心间，又何必为不能朝朝暮暮厮守一处而哀伤。	2	女孩子_秦文君	1
0	我怎么打她，她就是跪着不起来，打到最后连我自己都觉得没趣了，家珍头发披散眼泪汪汪地捂着脸。	3	余华_活着	1
4	烈日炎炎的夏天，地上像着了火一样。	0	-	2
6	驿寄梅花，鱼传尺素。	2	-	2
4	天都可以是我们的吗？	2	我的……_邓皓	1
0	龙二身后站着一个跑堂的，托着一盘干毛巾，龙二不时取过一块毛巾擦手。	3	余华_活着	1
1	果园里硕果累累，有红通通的苹果，梨子像小葫芦似的吊在树上。	0	-	1
0	那时我正在我爹坟前，我听到锣鼓声抬起头来，看到我丈人气冲冲地走到我家茅屋前，他朝后面摆摆手，花轿放在了地上，锣鼓息了。	3	余华_活着	1
1	我每次想到时间宝贵，就会想起这件往事，生命里的每一秒都是一只宝贵的鸟，它不断地张开翅膀飞去，仿佛天上的鹭鸶成行。	2	林清玄	1
0	今天继续上次大会的议程，废话就不多说了。	3	三体_刘慈欣	1
0	这中间他逃跑了七次，都被别的部队拉了去。	3	余华_活着	1
2	你老了，也不可能看到地球文明的最后毁灭，但我至少要让你知道你根本拯救不了她，我要让你活到她失去一切希望的那一天。	3	三体_刘慈欣	1
0	它正因寒冷而迅速减小。	3	三体_刘慈欣	1
2	水把头埋入地下，山却把心的碎片一块块收好。	0	-	1
0	眼前这架巨摆外形已经现代化，支撑天桥的两个高塔是全金属结构，每一个都有埃菲尔铁塔那么高，摆锤也是金属的，呈流线型，表面是光滑的电镀镜面，由于有了高强度材料，悬吊摆锤的线缆只有很细的一根，几乎看不到，这使得摆锤看上去像是空悬在两座高塔之间的空中。	3	三体_刘慈欣	1
0	再赊帐，你拿什么来还？	3	余华_活着	1
2	可能是牛放慢了脚步，老人又吆喝起来：二喜，有庆不要偷懒；家珍，凤霞耕得好；苦根也行啊。	3	余华_活着	1
0	连长那时候躲在坑道里赌钱，他气冲冲地反问：打炮，往哪里打？	3	余华_活着	1
2	我们来到小溪边，几条小鱼在水里欢快地游来游去，好像在说“春天来了！春天来了！”。	0	-	1
3	五十年间万事空，懒得白发对青铜。	0	-	1
2	一个小苍蝇在太阳光里快乐地飞舞着。	1	语文题库	1
0	我最后一次赌博时，家珍来了，那时候天都快黑了，这是家珍后来告诉我的，我当初根本不知道天是亮着还是要黑了。	3	余华_活着	1
11	你怎么可以这么浪费水资源呢？	1	语文题库	1
0	这个吝啬的人一想到要把这把草给别人，就呆住了，想得满头大汗，仍然舍不得给出去，最后，他突然开悟：原来左手也是我自己的手。	2	林清玄	1
0	走到了粪缸旁，他嫌缸沿脏，就抬脚踩上去蹲在上面。	3	余华_活着	1
2	三百多年，十几代人啊，它发芽时还是明朝呢，这漫长的岁月里，它经历过多少风雨，见过多少事。	3	三体_刘慈欣	1
0	仿佛从来就没有属于过那个躯体。	3	三体_刘慈欣	1
0	说完长根就要走，我和娘死活拦不住他，他说：你们别拦我了，往后我还要来看你们。	3	余华_活着	1
0	汽笛长啸，车就这样载着你驰向了南方那个城市，那个你将生活半年的城市。	2	送你去远行_单英福	1
0	圣上，不好了，计算有误！	3	三体_刘慈欣	1
0	那只金银两色的黄金鼠，引起逛夜市人群的围观，大部分的人议论纷纷：从来没有见过这样美丽的老鼠呀。	2	林清玄	1
11	这一点韧性，同院子里那些花比起来，不是显得非常可贵吗？	1	语文题库	1
0	观念的变革在美国，工作组多次召开留学生座谈会。	2	第五代_张建伟、左志	1
0	继而一想反正可以赊帐，日后总有机会赢回来，便宽了宽心，站起来对龙二说：先记上吧。	3	余华_活着	1
1	巨大的金属摆锤气势磅礴地摆动着，冲击着寒冷的空气，天边的小太阳把它的影子长长地投射到大地上，像一个顶天立地的巨人在行走。	3	三体_刘慈欣	1
1	世上好书，浩如烟海，一生不可能读完，且又有的书虽好，但不能全为之喜爱，如我一生不喜食肉，但肉却确实是世上好东西。	2	读书示小妹十八生日书_贾平凹	1
0	可你几分钟就把它锯倒了，你真没感觉到什么?	3	三体_刘慈欣	1
0	我把一个银元往她胸口灌进去，就把她的嘴堵上了。	3	余华_活着	1
0	哇，汪教授，汪院士!	3	三体_刘慈欣	1
0	以后的许多年里，我不断悟出这话的深意。	3	三体_刘慈欣	1
0	看看吧，这就是虫子，它们的技术与我们的差距，远大于我们与三体文明的差距。	3	三体_刘慈欣	1
0	一名大臣从洞门里跌跌撞撞地跑进来，带着哭腔喊道，天上，天上有三颗飞星！	3	三体_刘慈欣	1
0	仆人吓得连声说，我不是公子，打死我也不也敢。	3	余华_活着	1
0	爹拍拍我的手说：你去睡吧。	3	余华_活着	1
0	那个时候空气里满是焦糊和硝烟味，吸到嗓子眼里觉得有一颗一颗小石子似的东西。	3	余华_活着	1
9	过去的一切运动是少数人的或者为少数人谋利益的运动。无产阶级的运动是极大多数人的，为极大多数人谋利益的独立的运动。	0	-	1
4	我第一次发现，姐姐身上竟透出从未感觉过的动人美丽，而在这令人惊绝的美丽面前，是任何男人女人，妇孺妪翁都要倾倒的啊！	2	美丽人生_余志刚	1
0	中国古代知识分子贫穷落魄的多。	2	一个老知识分子的心声_季羡林	1
8	要讲究事实，对比事实，积累事实。	2	-	1
4	皆弹丸之地，而容量似海，岂仅是充饥解馋饕餮场所。	2	饭店铭_魏明伦	1
7	芦苇倒映在清凌凌的河水里，显得更绿了；天空倒映在清凌凌的河水里，显得更蓝了；云朵倒映在清凌凌的河水里，显得更白了。	1	语文题库	1
11	我站立之处成了看雨的好地方，谁能说这不是天地给我的恩泽？	1	语文题库	1
2	我向来都喜欢海边的卵石，因为这些石头从来没有隐藏，也不故意显露，它只是在海岸如实呈现它的美与风采。	2	林清玄	1
1	我骑在妓女身上经过他的店门时，我丈人身手极快，像只耗子呼地一下窜到里屋去了。	3	余华_活着	1
1	当他站得高、显得伟大的时候，一般有肉没有骨头，有躯壳没灵魂的人中狗，便成群地蜷伏在他脚下，仰起头来望望他，便伟大呵，伟大呵地乱叫一阵子。	2	伟大与渺小__臧克家	1
0	审问者：三体世界是否向降临派传授了某些高于人类现有科技水平的技术？	3	三体_刘慈欣	1
2	蓝笔颤抖着跌到桌下，她趴下去捡，抬起头来看见书房的黄光照得老师的笑油油的。	3	房思琪的初恋乐园_林奕含	1
1	西湖，就是镶嵌在这天堂里的一颗明珠。	0	-	2
7	儿子说：树的根要深入地里，吸收水分；树的叶子要和阳光进行光合作用；整棵树都要不断地吸入二氧化碳，吐出氧气；树是很忙的呀！	2	林清玄	1
0	我用镰刀时，她更不放心，时时说：福贵，别把手割破了。	3	余华_活着	1
0	不知道你有没有这样的体验：太阳落下去，月亮升起来，不，当太阳还没有落的时候，月亮就已经挂在澄碧的空中了，在它的周围，浸洇着黄昏将逝的胭脂色的天光，大地弥漫着袅袅的蓝雾。	2	走过列维坦_周树山	1
0	当然，我只是个工程师，没有能力进行这样级别的研究，只是一个科幻迷玩玩儿而已，从科学角度讲得出的结果肯定没什么意义，但从科幻角度讲却极有价值，因为那些结果展示的宇宙间点状文明的演化图景，不管正确与否，其诡异程度是很难凭空想出来的。	3	三体_刘慈欣	1
0	有的攥着卷儿大饼，一口咬下半截，把脖子撑得又粗又红。	3	骆驼祥子_老舍	1
0	自学古诗，回答问题。	1	语文题库	1
0	怕动了胎神，再热也只得忍耐。	2	林清玄	1
6	只要我们稍微停下脚步，就可以更好地珍惜生命本原的美丽，不为爱欲所炫目，不为污秽所恶心，永远正确看待生命，永远那么透明地看。	0	生命__沈从文	1
0	我采到过一枝有这么长的……	3	三体_刘慈欣	1
7	我们看到这个社会上拥有百亿资产，七十岁以上的人，还有很多人每天烦恼去何处开工厂；清晨就要赶去早餐会报；中午要看股票行情；连在路边散个步、吃一碗蚜仔面线也不可得呀！	2	林清玄	1
7	这庄严的宣告，这雄伟的声音，经过无线电的广播，传到长城内外，传到天山南北，传到白山黑水之间，传到大河长江之南，使全国人民一齐欢跃起来。	1	语文题库	1
9	弱智的孩子在母亲的眼中是那么天真、无邪，那么值得爱怜，我们自己对待正常健康的孩子则是那么严苛，充满了条件，无法全心地爱怜。	2	林清玄	1
11	安安死了，你哭，为什么不让我哭？	3	平凡的世界_路遥	1
0	我爹常常唉声叹气，训斥我没有光耀祖宗。	3	余华_活着	1
0	你到底想表达什么?	3	三体_刘慈欣	1
2	星星在天空中躲躲闪闪，时隐时现。	0	-	2
2	每一朵花都尽情绽放着笑颜，与阳光亲热。	1	语文题库	1
1	可以说，是红岸的眼睛。	3	三体_刘慈欣	1
0	污染了自己的生存之所，也终究在自己造成的污物中窒息而死。	2	这片土地是宝贵的_王芳	1
0	又想晒书，又想晒被，更愿痛痛快快洗一次衣物。	2	雨天的魅力_蓉子	1
6	沧浪之水清兮，可以灌我缨；沧浪之水浊兮，可以濯我足。	2	林清玄	1
0	冯·诺伊曼（注：现代计算机技术的莫基者）。	3	三体_刘慈欣	1
0	那天可真是热闹，城里街道两旁站满了人，手里拿着小彩旗，商店都斜着插出来青天白日旗，我丈人米行前还挂了一幅两扇门板那么大的蒋介石像，米行的三个伙计都站在蒋介石左边的口袋下。	3	余华_活着	1
8	不、不，与那些都没关系。	3	三体_刘慈欣	1
6	神仙饮琼浆玉液长生不老，百姓喝莲塘高梁欢乐健康。	1	语文题库	1
0	心疼儿子，又心疼钱，心里一阵温柔的牵痛，就说：“把我那张床给了你罢，我用你那张小床行了。“	0	-	1
2	祥子似乎喜爱雪花，大大方方的在空中飞舞，不象雪粒那么使人别气。	3	骆驼祥子_老舍	1
0	这叫我怎么回答呢？	3	余华_活着	1
8	那仆人还在前面向连长求情，走了一段路后，连长竟然答应了，他说：行，行，你回去吧，你小子烦死我了。	3	余华_活着	1
0	内蒙古生产建设兵团的六个师四十一个团十多万人就分布在这辽阔的森林和草原之间。	3	三体_刘慈欣	1
2	蓝天在对我们微笑。	1	语文题库	1
0	谢谢，不过我觉得这里很好，挺安静的。	3	三体_刘慈欣	1
9	花生长在地下，不像苹果那样高挂枝头。	0	-	1
11	这么远，箭哪能射得到呢？	0	-	1
0	风扇仍在旋转，一片灿烂的叶片不时划出地平线，给这个已经毁灭的世界带来一次次短暂的日出和日落，日落后灼热的大地发出暗红的光芒，转瞬而来的日出又用平射的强光淹没了一切。	3	三体_刘慈欣	1
0	她并没有像其他同行的人那样眺望云海，而是把目光集中到一个方向，在那一片云层下面，有一个叫齐家屯的小村庄……	3	三体_刘慈欣	1
9	这场纷扰，要直到大家的兴致均已低落，该说的话差不多都已说完，然后急转直下，突然平息，本就该坐上座的人便去就了上座，并无苦恼之相，而往往是显得踌躇满志、顾盼自雄。	2	话说谦让__梁实秋	1
0	还有一个晚上我打着手电赶夜路时，在一口池塘旁照到了两段赤裸的身体，一段压在另一段上面，我照着的时候两段身体纹丝不动，只是有一只手在大腿上轻轻搔痒，我赶紧熄灭手电离去。	3	余华_活着	1
0	那年沈先生和龙二的赌局，实在是精彩，青楼的赌厅里挤满了人，沈先生和他们三个人赌。	3	余华_活着	1
1	两个男青年步伐稳健有力，一副成熟的青年布尔什维克形象，他们都是物理系理论物理专业大四年级的，叶哲泰曾是他们的老师；那四名女孩子要年轻得多，都是大学附中的初二学生，这些穿着军装扎着武装带的小战士挟带着逼人的青春活力，像四团绿色的火焰包围着叶哲泰。	3	三体_刘慈欣	1
0	她由衷地赞叹道。	3	三体_刘慈欣	1
0	墙壁被一条条棕色的树皮覆盖着，三只凳子是古朴的树桩，写字台也是由三个较大的树桩拼成的，还有那张床，铺的显然是东北的乌拉草。	3	三体_刘慈欣	1
1	汪淼发现，所有巨摆的摇动都是同步的，远远看去，这景象怪异得使人着迷，像太地上竖立着一座座走动的钟表。	3	三体_刘慈欣	1
2	大树被拖走了，地面上的石块和树桩划开了树皮，使它巨大的身躯皮开肉绽。	3	三体_刘慈欣	1
7	竞争是一种苏醒，它逼醒了懒汉，逼醒了懦夫，逼醒了多年来捧着“铁饭碗”的人们！	0	-	1
7	沉香能够供佛、能够静心、能够去除秽气，是大家都知道的。	2	林清玄	1
4	飞流直下三千尺，疑是银河落九天。	1	语文题库	1
11	满腹经纶的学者，不要向人民夸示你们的渊博吧，在这一方面你不是能手，因你有福，有闲，有钱，你对于锄头拿得动、使得熟吗？	2	伟大与渺小__臧克家	1
0	家珍她们嘻嘻说着话走过去后，我问一个坐在地上的鞋匠：那是谁家的女儿？	3	余华_活着	1
0	叶文洁起身走出了监听主控室的大门，一阵冷风吹到她滚烫的脸上．东方晨曦初露，她沿着被晨光微微照亮的石子路，向发射主控室走去，在她的上方，红岸天线的巨掌无声地向宇宙张开着。	3	三体_刘慈欣	1
4	这穷山穷水长不起来树，木料贵得怕死人……	3	平凡的世界_路遥	1
4	这样的伟人，拔地几千尺，活在半空里，和群众、和现实，脱离得一干二净。	2	伟大与渺小__臧克家	1
0	龙二向一个跑堂挥挥手说：给徐家少爷拿块热毛巾来。	3	余华_活着	1
0	到处都是一柱柱冲天的浓烟。	3	余华_活着	1
1	我经常让她背着我去逛街，我骑在她身上像是骑在一匹马上。	3	余华_活着	1
0	我不相信乌云会使太阳消失，我不信月亮的色彩会超过太阳的光芒。	2	我不相信_佚名	1
9	十年前，这里还是头上青天一顶，脚下荒原一片；如今，笔直的柏油马路向远方伸展，辽阔的田野接着天边。	0	-	1
0	巴尔特爱笔成痴，喜欢买各种笔，写一篇文章总爱新笔旧笔换来换去地写。	2	听那立体的乡愁_董桥	1
0	教皇温和地说，他脸上的笑汪淼有些熟悉，那是纣王的笑。	3	三体_刘慈欣	1
5	她大大的眼睛忽闪忽闪的，我对她说：“你的眼睛真闹啊，别眨了。”	0	-	1
0	那大部分人的人生都是偶然。	3	三体_刘慈欣	1
0	叶哲泰从文革开始一直活到了现在，并且一直处于第一阶段，他不认罪，不自杀，也不麻木。	3	三体_刘慈欣	1
2	当别人靠近他的时候，它们便狺狺狂吠起来，在壮主子的声威之余，自己仿佛也有威可畏了。	2	伟大与渺小__臧克家	1
4	被包围的不只是我们一个连，有十来万人的国军全被包围在方圆只有二十来里路的地方里，满地都是黄衣服，像是赶庙会一样。	3	余华_活着	1
1	有时下夜班，仰望夜空，觉得群星就像发光的沙漠，我自己就是一个被丢弃在沙漠上的可怜孩子……	3	三体_刘慈欣	1
5	她柔美的发丝像花香一样飘逸。	0	-	2
0	过了一会，我们看到春生怀里抱着一堆胶鞋猫着腰跑来了，这孩子高兴得满脸通红，他一翻身滚了进来，指着满地的胶鞋问我们：多不多？	3	余华_活着	1
0	他提到了二胡和人民，那样正义。	2	因为门德尔松_晓舟	1
11	是不是有时候觉得，自己都忍不住讨厌起自己来了？	2	一个人的游戏_　　一个人无聊的时候，会做什么事呢？	1
11	他难道不是个善良的人吗？	0	-	2
0	我默默期待，何时才是它的花期？	2	君子兰_李昆纯	1
0	很多人都坐着没动，有一些人走出去，还真的走到那桌子前去领了盘缠，那个长官一直看着他们，他们领了钱以后还领了通行证。	3	余华_活着	1
0	真没想到世界末日是这么的爽，虫子万岁，智子万岁！	3	三体_刘慈欣	1
1	你看，过去月亮扁扁的肚子，喝得象小西瓜一样圆绷绷了。	2	童心小世界_散文	1
0	瘦小女人说，她的声音尖尖的，仿佛时刻都带着一种不知从何而来的惊恐。	3	三体_刘慈欣	1
4	三万里河东入海，五千仞岳上摩天。	0	-	1
2	秋天，是一个穿着金色衣裙的仙女，用宽大的衣衫挡着风寒，却捧起沉甸甸的果实奉献人间。	1	语文题库	1
