7	他自己，喜怒哀乐，不能自由，不愿自由，不敢自由，硬把人之所以为人的一些天性压抑，闷死，另换上一些人造的东西，这样弄得长久了，自己也觉得自己不是人了，而成了人以上的另一种人的人。	2	伟大与渺小__臧克家	1
8	我不想，不想，不想长大。	0	-	2
1	手伸进光影里，就像长出豹纹一样。	3	房思琪的初恋乐园_林奕含	1
0	她这个将被冻死的小女孩儿手中连火柴都没有，只有幻觉了……	3	三体_刘慈欣	1
9	我想起《佛经》里的一句话：如蜂采华，但取其味，不损色香，就觉得人在情感的态度上，有时还不如一只蜜蜂。	2	林清玄	1
2	最奇特的是几只孔雀，几乎是奔跑着过来乞食，还大声哈哈叫着。	2	林清玄	1
5	握着她的手，传来一阵甜甜的喜悦。	0	-	1
0	路两旁的油菜花开的金黄金黄，蜜蜂嗡嗡叫着飞来飞去。	3	余华_活着	1
0	春生站了起来，我没叫他小心子弹，他看了看说：兴许外面还有饼，我去找找。	3	余华_活着	1
11	这些缺陷者在艺术上的卓越成就不就是些雄辩的例证吗？	0	-	1
6	爱情是喻依，死亡是喻体。	3	房思琪的初恋乐园_林奕含	1
7	完全的溶入，是无私的、无我的，无造作的，就好像灯泡的钨丝突然接通，就会点亮而散发光辉。	2	林清玄	1
7	这里的岭的确很多，横着的，顺着的，高点儿的，矮点儿的，长点儿的，短点儿的，可是没有一条使人想起云横秦岭那种险句。	1	语文题库	1
0	旁边一个解放军对我说：他是团长。	3	余华_活着	1
10	差不多先生真是一位有德行的人。	0	-	1
2	故乡的水土生养我们，使我们长成顶天立地的男儿，即使漂流万里，在寂寞的异国之夜，也能充满柔情与壮怀。	2	林清玄	1
0	我童年的时候就很疑惑，金龟子是如何在遥远广大的田园辨味，穿过树林而飞回的呢？	2	林清玄	1
0	我时常和兄弟到二姑家，庄主有闲最好，庄主若是无闲，我们会自己到果园去饱餐一顿，然后躺在西厢房前的宽大条椅上睡午觉，一静下来，庄外草花全部话转来，蝴蝶四处飞，庄内盘旋着无以名状的香气。	2	林清玄	1
0	哦，我是亚历士多德。	3	三体_刘慈欣	1
10	他把所有的人都给骗了，不得不说他的确有一套啊。	0	-	1
0	捕到老鼠的小朋友说：可是，可是老鼠是害虫呀！	2	林清玄	1
6	这样的人，是性相近也，习相远也，远的是民众，是人性。	2	伟大与渺小__臧克家	1
0	我是搞应用研究的，没有你们理论派那么敏感。	3	三体_刘慈欣	1
0	好孩子，你真聪明，门部件的正确运行你是关键，好好干，皇帝会奖赏你的！	3	三体_刘慈欣	1
6	钟灵毓秀，人杰地灵。	2	-	2
0	在这个世界上，有很多很多人愿意舍弃所有的财富，只换回自己的妈妈都不可得呀！	2	林清玄	1
7	自信，是走向成功的伴侣，是战胜困难的利剑，是达向理想彼岸的舟楫；有了它，就迈出了成功的第一步；有了它，就走上了义无反顾的追求路。	0	-	1
0	有个娃娃兵向他喊：连长，蒋委员长还救不救我们？	3	余华_活着	1
2	天空里撒满了快活地眨着眼睛的星星。	1	语文题库	1
0	看到家珍跪着我就火了，心想我儿子还没出来就跪着了，这太不吉利。	3	余华_活着	1
2	如果我们放弃事业，在安乐窝里消磨人生，我们就有愧于贫穷的祖国，有愧于人民的培养，我们的良心就要忍受羞愧的折磨。	2	要事业，也要生活_张红	1
0	金字塔被雪埋了起来，最下层是水的雪，中层是干冰的，上层是固态氧、氮的雪。	3	三体_刘慈欣	1
0	伟大的始皇帝，这是机器的机械运行，不是智慧。	3	三体_刘慈欣	1
0	我正高兴着，有人扯了扯我的衣服，低头一看是自己的女人。	3	余华_活着	1
1	天上的彩虹好像一座七彩的桥。	0	-	1
10	放心，你的“好”，我一辈子也忘不了！	0	-	1
0	我娘常说地里的泥是最养人的，不光是长庄稼，还能治病。	3	余华_活着	1
2	想起一些人时，总感觉自己的生命是切成一段段的，每一段都和一些人联在一起，没有了这些人，生命似乎也就苍白贫乏，没个着落了。	2	想念_逸之	1
0	那么，请陛下发出您伟大的号令吧！	3	三体_刘慈欣	1
1	那溪石多么好看，有的像一群小牛在饮水；有的像一对狮子在睡觉；有的像几只小熊在嬉戏玩耍。	1	语文题库	1
4	传说正是他的眼泪流成了这条小河。	3	平凡的世界_路遥	1
0	那天午后，我走到了一棵有着茂盛树叶的树下，田里的棉花已被收起，几个包着头巾的女人正将棉秆拔出来，她们不时抖动着屁股摔去根须上的泥巴。	3	余华_活着	1
9	瞧，春风是那样缠绵，让人神清气爽，而夏天的风，则带着丝丝暖意，让人暖意十足。	0	-	1
0	如果世界文明没有未来，你们那点荣誉算个屁！	3	三体_刘慈欣	1
0	看得见的时候我都在田里，到了天黑，只要有月光，我还要下地。	3	余华_活着	1
10	那马是大王最喜欢的，却要以大夫的礼节安葬它，太寒酸了，请用君王的礼节吧！	0	-	1
0	不知过了多久，才有人怯生生地打破沉寂：江教授，’飞刃’是丝状的吗？	3	三体_刘慈欣	1
2	那拱卫在泰山膝盖下的无数小馒头，却是沮涞山等著名的山岭。	0	-	1
4	东方明珠电视塔的气势是那样的雄伟，看上去又是那样的让人心惊，好像随时都会倒下来似的。	0	-	1
0	我那还没活人的安安啊！	3	平凡的世界_路遥	1
4	这橘子酸得我的牙都快掉了。	0	-	1
2	啊，听起来多痴情，像电影里的，我真希望能戒掉你。	3	房思琪的初恋乐园_林奕含	1
7	自私是一面镜子，镜子里永远只看得到自己；自私是一块布匹，蒙住了自己的眼睛，看不见别人的痛楚；自私是一层玻璃，看上去透明，却始终隔开了彼此的距离。	0	-	1
2	枪口对准星星，星星大吃一惊。	0	-	2
0	走的时候是深秋，回来是初秋。	3	余华_活着	1
0	他在我家干了几十年，现在也要离开了。	3	余华_活着	1
4	大楼高得快要比天还高，已经在云霄边。	0	-	2
0	台语所说的病母，使我联想到另外一句台语叫作西瓜偎大边，一般人都以为这句话的意思是一个人趋炎附势，投靠有权势的一边，其实，这句话原来的意思是，像西瓜这样的水果，身体好的人愈吃愈补，身体虚的人愈吃愈虚。	2	林清玄	1
0	龙二赶紧说：没输，你们赢啦。	3	余华_活着	1
0	兆鹏兆海的脸冻皱了，手脚冻得淌黄水。	3	白鹿原_陈忠实	1
9	有时候，我对人类的弱点怀有如此温柔的同情，远远超过对优点的钦佩。	2	宽待人性_迷者的悟	1
1	人生的际遇是这般无常，数十年仿如一眨眼的瞬间，在回程的路上，我看着依然美如诗画的沟坪，有一种忧伤的心情，好像看到一只叫无常的鸟飞过，着无奈的长音。	2	林清玄	1
7	有喜有忧，有笑有泪，有花有果，有香有色，这就是养花的乐趣。	1	语文题库	1
0	就那么一会儿工夫，我瘦了整整一圈，眼都青了，自己还不知道，回到了家里，我娘一看到我就惊叫起来，她看着我的脸问：你是福贵吧？	3	余华_活着	1
1	庄稼汉们站在地头，望着这片黄澄澄像狗尾巴的稻谷，心里像酿了蜜一样的甜。	0	-	1
2	我爹喜欢看着天色慢慢黑下来，罩住他的田地。	3	余华_活着	1
0	她陶醉在这鲜红灿烂的梦幻中，直到被一颗步枪子弹洞穿了胸膛，十五岁少女的胸膛是那么柔嫩，那颗子弹穿过后基本上没有减速，在她身后的空中发出一声啾鸣。	3	三体_刘慈欣	1
0	我多么希望这世间的子女都能体贴父母的心呀！	2	林清玄	1
0	我是在拐弯处看到她，她一扭一扭地走过来，高跟鞋敲在石板路上，滴滴答答像是在下雨，我眼睛都看得不会动了，家珍那时候长得可真漂亮，头发齐齐地挂到耳根，走去时旗袍在腰上一皱一皱，我当时就在心里想，我要她做我的女人。	3	余华_活着	1
0	这位老人后来和我一起坐在了那棵茂盛的树下，在那个充满阳光的下午，他向我讲述了自己。	3	余华_活着	1
0	程丽华的一席话拉近了叶文洁与她的距离，但叶文洁在灾难中学会了谨慎，她不敢贸然接受这份奢侈的善意。	3	三体_刘慈欣	1
11	看看我，我难道会害你吗?	3	三体_刘慈欣	1
9	有的人太自私，对公事敷衍了事，对自己的私事却一丝不苟。	0	-	1
9	他那么爱你，你却对他敷衍了事！	0	-	2
0	哦，怪不得她说你很聪明的。	3	三体_刘慈欣	1
0	你还在教学中散布宇宙大爆炸理论，这是所有科学理论中最反动的一个!	3	三体_刘慈欣	1
9	虚心使人进步,骄傲使人落后。	0	-	2
0	这么一想，我都走不动路了，在道旁蹲下来哭得腰里直抽搐。	3	余华_活着	1
2	已经知道，这是地球上最长的海产植物，可以长至四百米，借巨大的吸盘附着在岩石上面，又借一段浮体支持自己，同时以千万个琥珀色小乳头喂养大蓬的头发。	2	聂鲁达散文诗选_巴勃罗・聂鲁达	陈实	1
5	天上的星星越聚越多，闪闪亮亮的，特别闹。	0	-	1
1	北极星像盏指路灯一样挂在天空。	0	-	2
11	喔天哪，房思琪，你明明知道我多崇拜老师，为什么你要把全部都拿走？	3	房思琪的初恋乐园_林奕含	1
0	如一个孕育着生命的母亲，期待着自己将要出生的婴儿。	2	我的四季_张洁生命如四季。	1
8	敌人把你的城镇变成了废墟，你没有哭；敌人把你的国家烧成了灰，你没有哭；敌人杀死了你的亲人，你没有哭；敌人把你绑在大树上，烧你，烤你，你没有哭；你真是一把拉不断的硬弓，一座烧不毁的金刚！	0	-	1
7	所谓菩提者，常在提升与超越；所谓般若者，常有弹性与柔软；所谓空性者，扫除了一切的盲点、暗影与欲求；有如湛明的天空。	2	林清玄	1
2	儿子说：爸爸，你错了，树其实是非常忙碌的。	2	林清玄	1
0	当直升机轰鸣着飞上英伦雾蒙蒙的天空时，仿佛时光倒流，叶文洁感到一切都似曾相识。	3	三体_刘慈欣	1
0	向着同一个地方弯过去。	3	余华_活着	1
7	汽车吼叫着，车身摇晃着，卵石挤碰着，水花四溅，我们的心也怦怦直跳……	1	语文题库	1
2	豆在釜中泣。	1	语文题库	1
2	是谁准确、及时地按住大海的脉搏，使它紧随祖国前进的步伐一齐跳动呢？	1	语文题库	1
8	我真傻，真的。	0	-	1
1	母亲是不熄的篝火，一直温暖着我们的家。	0	-	1
0	原先大伙还指望着稻草能派上用场，这么一来稻子没收起，稻草也全烂光了。	3	余华_活着	1
0	我可以在这里待一辈子。	3	三体_刘慈欣	1
7	在学校里，在单位里，我怕那里只有一条街，走在路上，一式地点头，给别人点头，别人给自己点头，双方努力点头；还要陪上掌握分寸的笑；还应有相应的不冷不热、不东不西的话语，如吃了？	2	怕_赵曙光	1
0	我曾经遇到一个哭泣的老人，他鼻青眼肿地坐在田埂上，满腹的悲哀使他变得十分激动，看到我走来他仰起脸哭声更为响亮。	3	余华_活着	1
1	我之想象，犹如长箭，向云空射去，去即不返。	2	生命__沈从文	1
0	爹轻声说：福贵啊，赌债也是债，自古以来没有不还债的道理。	3	余华_活着	1
0	我看到凤霞站在那里，手里拿着稻穗，直愣愣地盯着龙二看，就赶紧对她说：凤霞，快向龙老爷行礼。	3	余华_活着	1
7	我爱小草，爱他默默无闻的精神，我爱他顽强不屈的品格，我爱他顽强的生命力，我更爱他直面挫折的勇气。	0	-	1
0	我们一排二十多个俘虏由他一人押着向南走去，走不多远就汇入到一队更大的俘虏里。	3	余华_活着	1
2	它矍先停在草地上，在那里讨论什么事情似的，这时我听到母麻雀与小麻雀的声音竟不相同，大约低了两度左右，略为沙哑。	2	林清玄	1
0	这个倒计时还在继续吗?	3	三体_刘慈欣	1
0	它年年摇摇欲坠，但年年都存在着。	3	平凡的世界_路遥	1
0	家珍走后两个多月，托人捎来了一个口信，说是生啦，生了个儿子出来，我丈人给取了个名字叫有庆。	3	余华_活着	1
0	就是在这样的时刻，我遇到了福贵，他绘声绘色地讲述自己，从来没有过一个人像他那样对我全盘托出，只要我想知道的，他都愿意展示。	3	余华_活着	1
0	龙二遇到我还算客气，常笑嘻嘻地说：福贵，到我家来喝壶茶吧。	3	余华_活着	1
8	连长握着手枪向他挥动着说：站起来，站起来。	3	余华_活着	1
1	美妙的小雪花呀，像只只空灵飘逸的玉蝴蝶，扇动着薄翼，初降人间。	0	-	1
3	朱门酒肉臭，路有冻死骨。	0	-	1
1	豆大的雨点像鞭子一样毫不留情地拍打着一切。	1	语文题库	1
1	当时地面仍在严寒中，雨水在树上冻住，每棵树都挂起了大冰挂子，森林成了水晶宫，其间不断地响着树枝被压断的咔嚓声和冰挂子坠地的轰轰声。	3	三体_刘慈欣	1
0	哦，我们在雷达峰干，那里林木真密，地下的腐叶齐膝深，我真怕中了瘴气。	3	三体_刘慈欣	1
0	监听员从噩梦中醒来，看到刚刚升起的巨月把—束冷光投进小窗。	3	三体_刘慈欣	1
5	他真的是可盐可甜，实在是太戳我了。	0	-	1
4	这座楼真高啊！站在楼顶上，一伸手感觉就可以触到云朵，摸到太阳。	0	-	2
0	每一张人片都在迅速吸水膨胀，渐渐地，湖面上的人片都变成了圆润的肉体，这肉体很快具有了生命的迹象，一个个挣扎着从齐腰深的湖水中站立起来他们睁大如梦初醒的眼睛看着这风和日丽的世界。	3	三体_刘慈欣	1
8	谢谢，谢谢，谢谢各位好心人！	0	-	2
0	家珍脱掉了旗袍，也和我一样穿上粗布衣服，她整天累得喘不过气来，还总是笑盈盈的。	3	余华_活着	1
0	把‘琴’立起来。	3	三体_刘慈欣	1
0	我们徐家就是这样发起来的。	3	余华_活着	1
7	一整面墙的原典标榜他的学问，一面课本标榜孤独，一面小说等于灵魂。	3	房思琪的初恋乐园_林奕含	1
0	于是，在他们的油锯和电锯下，大片的林海化为荒山秃岭；在他们的拖拉机和康拜因(联合收割机)下，大片的草原被犁成粮田，然后变成沙漠。	3	三体_刘慈欣	1
0	老实回答下面的问题：在六二至六五届的基础课中，你是不是擅自加入了大量的相对论内容?	3	三体_刘慈欣	1
2	妈妈看我望着她，以为我要放声哭出来，突然大声地骂天：都是这么恶的风，吹得阿玄仔仆倒！	2	风中跌倒不为风__林清玄	1
6	吃得苦中苦，方为人上人。	2	-	2
0	可我娘的身体更叫我担心，我就拿过银元。	3	余华_活着	1
4	一个西瓜装满车，压得地球直哆嗦。	0	-	1
7	您好比一架穿梭机，能带我们穿越历史长河；您好比一把钥匙，能帮我们打开迷惘的心锁；您好比一颗启明星，带领我们走向洒满阳光的天堂。	0	-	1
2	那不是它的项链，而是它的伤痕，这只海狮小时候在海里玩，看到一个项圈，它就钻进去玩，没想到钻进去就拿不出来，小海狮一直在长大，项圈愈来愈紧，就陷进肉里，流血、痛苦，就在它快被勒死前被发现了，把线圈剪断才救了它。	2	林清玄	1
1	它们的身上都带着火焰，在大地上织成一张移动的火毯。	3	三体_刘慈欣	1
0	太阳就快要出来了，遥远的东方染上一层薄薄的金色。	0	-	1
11	累了，花几十元在三希堂喝故宫特选的乌龙茶，生活不是非常的惬意吗？	2	把时间花在心灵上__林清玄	1
11	我们怎能忘记中华母亲承受的千灾百难？	1	语文题库	1
0	一想到她昨晚来劝我回家，我却对她又打又踢，我就扑嗵一声跪在她面前，对她说：家珍，我完蛋啦。	3	余华_活着	1
0	这八天中，人们享受着每天二十个小时、周期准确的日出日落。	3	三体_刘慈欣	1
0	但这些谈话内容是真实的，你要相信组织。	3	三体_刘慈欣	1
0	那次我一直赌到天亮，赌得我头晕眼花，胃里直往嘴上冒臭气。	3	余华_活着	1
0	这时村里传来了锣鼓声，队长带着一队人从村口走出来，队长看到我们后高兴地挥着手喊道：福贵，你们家立大功啦。	3	余华_活着	1
8	日本帝国主义的兵队强占了吉辽、炮轰机关，他们不惊诧；阻断铁路，追炸客车，捕禁官吏，枪毙人民，他们不惊诧。	0	-	1
2	说的时候，我感觉这句话是对自己说的，而那作了记号的金龟子，是从故乡的记忆中飞来，又带着我的乡愁，飞向不知名的所在！	2	林清玄	1
4	玫瑰真香啊，香得十里外都闻得到。	0	-	1
9	一本好书胜过珍宝，一本坏书比一个强盗更坏。	0	-	1
0	对，那时你们可真的什么都不是了！	3	三体_刘慈欣	1
0	我说：没有。	3	余华_活着	1
1	一声巨响，两座发着红光的山峰砸落在远方的大地上，整个荒原笼罩在红色光芒之中。	3	三体_刘慈欣	1
3	恍惚中，几把“明晃晃的大刀”冲了进来。	0	-	2
0	你想让我感觉到什么呢?	3	三体_刘慈欣	1
6	人情留一线，日后好相看。	2	林清玄	1
2	索桥终日默默无闻地为人民奉献自己的力量。	1	语文题库	1
0	祥子，和别的车夫一样，最讨厌自行车。	3	骆驼祥子_老舍	1
0	你到底知道些什么?	3	三体_刘慈欣	1
2	这等于说正确的哲学是从天上掉下来的，这反对实践出真知，恰恰是违背马克思主义对自然界的认知原则的。	3	三体_刘慈欣	1
0	只要上面怎么说，我们就怎么想，怎么做。	3	余华_活着	1
4	寒冷黎明中的大地上空荡荡的一无所有。	3	三体_刘慈欣	1
0	龙二抢先亮出了黑桃Ａ，沈先生怔了半晌，才把手中的牌一收说：我输了。	3	余华_活着	1
0	没有人问，也无人知道。	2	林清玄	1
0	可惜我们人类的文明史尚短，潜移默化尚未能奏大效，露出原始人的狰狞面目的时候要比雍雍穆穆地举行谦让仪式的时候多些。	2	话说谦让__梁实秋	1
0	快，找阴凉地儿！	3	三体_刘慈欣	1
1	怡婷写：诚实是一封见不得人的情书，压藏在枕头下面，却无意识露出一个信封的直角，像是在引诱人把它抽出来偷看。	3	房思琪的初恋乐园_林奕含	1
0	车灯再次放光――依然零下20度的严寒，依然沉重的苏维埃军车，雪雾挟裹着浩浩雄风，车队驰向远方……	2	蓝色的勿忘我花_竹林	1
6	痛苦是牺牲的决心，痛苦是献身的庄严。	2	风格散记（选六则）_王蒙	1
4	汪淼感到摆锤在摆动中仿佛产生了一股巨大的力量，仿佛大地被它拉得摇摇晃晃。	3	三体_刘慈欣	1
11	要不然，一向节俭的母亲怎么会单单在这件事上大方起来呢？	1	语文题库	1
7	人们都爱秋天，爱她的天高气爽，爱她的云淡日丽，爱她的香飘四野。	1	语文题库	1
1	随着时间的流逝，这种虚幻感越来越强烈，那件事越来越像自己的幻觉，像一场梦。	3	三体_刘慈欣	1
0	最难受的就是天越来越冷，睡上几分钟就是冻醒一次。	3	余华_活着	1
0	哦，楠楠，你的画儿画完了吗？	3	三体_刘慈欣	1
1	我爹和我，是远近闻名的阔老爷和阔少爷，我们走路时鞋子的声响，都像是铜钱碰来撞去的。	3	余华_活着	1
0	后天可以把任务完成吗？	0	-	1
0	我娘问她：是谁家的小姐，你找谁呀？	3	余华_活着	1
0	他伤心地哭了，结结巴巴地说：连长，我拉大炮吧。	3	余华_活着	1
0	家珍那天晚上走了十多里夜路回到了我家。	3	余华_活着	1
0	夜里想得太多，白天就头疼，整日无精打采，好在有凤霞，凤霞常拉着我的手问我：爹，一张桌子有四个角，削掉一个角还剩几个角？	3	余华_活着	1
10	这个孔武有力的男人在与妇女儿童的对战中大显神威，真不愧是个好汉哇！	1	语文题库	2
2	宁静的夜晚，只有那天上的星星在窃窃私语。	0	-	1
4	风，也屏住了呼吸，山中一下子变得非常幽静。	1	语文题库	1
11	人们怎么不希望车子能停下来，不希望时间能停下来？	0	-	1
0	从前，我听收音机不小心收到渔业气象，总是立刻转台，不觉得那有什么意义，现在才知道光是风浪几级，里面也有非常深刻的意义。	2	林清玄	1
2	在青春的路口，曾经有那么一条小路若隐若现，召唤着我。	2	非走不可的弯路__张爱玲	1
4	一本好书，我读上一千遍也不会厌倦。	1	语文题库	1
11	这里的工作多么重要，我哪能离开呢？	1	语文题库	1
0	家珍细声细气地说：你跟我回去。	3	余华_活着	1
0	因此我焚了那个稿件。	2	生命__沈从文	1
6	我蓦然回首，哑然失笑。	2	春拂玉兰枝_荒平	1
0	几声孤单的掌声在阴冷的大殷中回荡，这掌声是伽利略的。	3	三体_刘慈欣	1
0	发射文档号：22；附加：无；续传：无；文档最后校核完毕，20秒倒数!	3	三体_刘慈欣	1
0	佃户提着镰刀跑到我爹跟前，问他：老爷你没事吧？	3	余华_活着	1
0	仔细看看。	2	生命__沈从文	1
0	不只是把罪恶感说开，罪恶就淡薄一些，老师到头来根本是享受罪恶感。	3	房思琪的初恋乐园_林奕含	1
2	思想伸出手就无力地垂下来。	3	房思琪的初恋乐园_林奕含	1
1	急忙打开书，一页，两页，我像一匹饿狼，贪婪地读着。	1	语文题库	1
0	我摇摇头，心想还是回家吧。	3	余华_活着	1
0	赌场无赢家，我是见好就收，免得日后也落到你这种地步。	3	余华_活着	1
1	叶文洁第一眼看到巨轮时，就想起了雷达峰，这时她才想到那山峰的形状真的像一艘巨船，周围的大西洋像是大兴安岭的森林，但真正让她联想到红岸基地的是巨轮中都竖立着的那面巨大的抛物面天线，它像巨轮的一面圆形的大帆。	3	三体_刘慈欣	1
1	别人在海滩上捡到一块贝壳，她却要研究一下这贝壳是怎样生、怎样长，怎样冲到海滩上来的，别人摸瓜她寻藤，别人摘叶她问根。	0	-	1
0	典礼隆重而又简朴。	3	白鹿原_陈忠实	1
0	但原因本身在这里很难说清，也可能对我们这些非专业人士根本就说不清。	3	三体_刘慈欣	1
1	这是上帝对我们努力的奖赏！	3	三体_刘慈欣	1
5	战士们唱的歌酸酸的，让人想落泪。	0	-	1
2	然后，它繁衍的子孙，一代一代，也不必教育和学习，就会飞翔和采花了。	2	林清玄	1
0	这么好的女人，我对她又打又踢。	3	余华_活着	1
0	金字塔四角的四尊青铜大鼎同时轰地燃烧起来，站满了金字塔面向方阵一面坡墙的士兵用宏大的合唱将始皇帝的号令传诵下去：成计算机队列——下面的大地上，方阵均匀的色彩开始出现扰动，复杂精细的回路结构浮现出来，并渐渐充满了整个方阵，十分钟后，大地上出现了一块三十六平方公里的计算机主板。	3	三体_刘慈欣	1
11	李大钊同志对革命事业充满信心，怎么会惧怕反动军阀？	0	-	1
0	我从不曾看见，在长途汽车车站售票的地方，如果没有木制的长栅栏，而还能够保留一点谦让之风！	2	话说谦让__梁实秋	1
0	长根那天走后，还来过一次，那次他给凤霞带来一根扎头发的红绸，是他捡来的，洗干净后放在胸口专门来送给凤霞。	3	余华_活着	1
11	当你听到这段英雄事迹的时候，难道你不觉得我们的战士是最可爱的吗？	0	-	1
0	有人喊：统帅来了!	3	三体_刘慈欣	1
2	它们可不是僵硬的符号，而是有着独特性格的精灵。	1	语文题库	1
8	我们要一直前进，前进，向着新家园前进！	0	-	1
11	看，雨后的西湖多美啊，像一位女子，难度不是是淡妆好看吗？	0	-	1
3	远处，一个个红领巾正向我们走来。	0	-	1
0	队长是谁？	3	余华_活着	1
0	让我们今天来为生命创造一点什么吧！	2	林清玄	1
2	湖水也一改冬日的沉静，调皮地泛起层层微波，搅乱了投射在湖边的倒影。	0	-	1
5	朦胧的墨绿中，清晰地闪着点点火红的花朵，宛如一阕厚重、平和的弦乐声中跳出了一管清脆、欢跃的笛音	0	-	2
2	头发约莫一寸长，显然好久没有剪了，却一根一根精神抖擞地直竖着。	1	语文题库	1
11	只是混乱的湍流中一个短命的旋涡?	3	三体_刘慈欣	1
0	妈妈拍地的动作非常滑稽夸张，使那哭闹不停的孩子也忍不住破涕为笑了。	2	风中跌倒不为风__林清玄	1
1	那些大空中的眼睛是很精致的雕塑，栩栩如生，它们都看着下面的行星，目光似乎地诡异。	3	三体_刘慈欣	1
2	那花朵虽然娇弱但是绚丽无比，她在天堂闲适中感受着自由和美。	3	三体_刘慈欣	1
0	我刚看了一本书，感触很深……	3	三体_刘慈欣	1
