0	那就是研究恒星吧，怎么会没用处呢?	3	三体_刘慈欣	1
10	我心里暗笑他的迂，他们只认得钱，托他们只是白托；而且我这样大年纪的人，难道还不能料理自己吗？我现在想想，那时真是太聪明了！	0	-	1
8	走着走着，他想起刚才看的电影里敲梆老头被害的情景。	0	-	1
10	这屯子还是数老孙头能干，又会赶车，又会骑马，摔交也摔得漂亮，啪嗒一响掉下地来，又响亮又干脆！	0	-	1
2	我躺在床上，他便伶伶俐俐地从我身上跨过，从我脚边飞去了。	1	语文题库	1
0	我苦笑着看他走远，心想还是别在这里站着，就走动起来。	3	余华_活着	1
0	吆喝着好，吆喝得马驹骡驹听见卖馍卖糖的梆子钤鼓响，就跟听见卖辣子的吆喝一样就好了。	3	白鹿原_陈忠实	1
2	人面不知何处去，桃花依旧笑春风。	1	语文题库	1
11	这其中许多的谈话都是在你家里进行的，你妹妹都知道你就不知道?	3	三体_刘慈欣	1
0	但是修行要反其道而行，修行要保持内在的空间，在世人都迷乱的时代，我们在内心里清明就好，外表上宁可作傻瓜。	2	林清玄	1
0	但科幻写到今天，能够与大家同行这么长一段，也是缘份。	3	三体_刘慈欣	1
2	索溪尤其爱跟山路哥哥闹着玩。	1	语文题库	1
1	在这碧紫透红的群峰之上，你像昂扬的战旗在呼啦啦地飘。	1	语文题库	1
0	那孩子的年纪就和我凤霞差不多大，我想这可能是县太爷的公子，就走上去对他说：我来帮你敲。	3	余华_活着	1
10	这可真是太了不起了，都迈出第一步了。	0	-	2
7	渺小是要把人列在一列平等的线上，渺小是自大、狂妄、野心、残害的消毒药，渺小是把人还原成人，是叫人看集体重于个人。	2	伟大与渺小__臧克家	1
1	一串串葡萄如同珍珠般可爱。	1	语文题库	1
4	三个老红卫兵走到叶文洁面前，面对着她站成了一排—一当年，她们也是这样面对叶哲泰的——试图再现那早已忘却的尊严，但她们当年那魔鬼般的精神力量显然已荡然无存。	3	三体_刘慈欣	1
0	丁仪摇摇头：不行，这种武器已广为人知，我们不知道船体是否装备了屏蔽球状闪电的磁场墙；即使没有，球状闪电虽然可以保证消灭船内的所有人员，但也不能保证同时性；而且，球状闪电进入船体内部后，可能还要在空中游荡一段时间才会释放能量，这段时间短则十几秒钟，长就有可能达到一分钟甚至更多，他们完全有时间察觉到袭击并采取毁灭信息的行动。	3	三体_刘慈欣	1
0	我和儿子坐在仁爱路安全岛的大树下喂鸽子，凉风从树梢间穿人，树影婆婆，虽然是夏日的午后，也感到十分凉爽。	2	林清玄	1
2	只有不多的几个人还在呜呜地响，那声音一段一段的，飘来飘去，听上去像是在说话，你问一句，他答一声，声音凄凉得都不像是活人发出来的。	3	余华_活着	1
9	龙二和沈先生不一样，沈先生是只赢不输，龙二是赌注小常输，赌注大就没见他输过了。	3	余华_活着	1
1	不知从什么地方跳出一只野兔来，箭一样地蹿过雪堆。	1	语文题库	1
8	我两条腿像是夹马似的夹了夹妓女，对她说：跑呀，跑呀。	3	余华_活着	1
1	张主任的眼睛像两个黑洞洞的枪口对着她，我警告你，诬陷别人会使你的问题更加严重。	3	三体_刘慈欣	1
10	这不正对你的胃口吗？怎么又不要了呢？	0	-	2
7	你好，清凉的山泉！你捧出一面明镜，是要我重新梳妆吗？你好，汩汩的溪流！你吟诵着一首首小诗，是邀我与你唱和吗？你好，飞流的瀑布！你天生的金嗓子，雄浑的男高音多么有气势。	1	语文题库	1
1	皎洁的明月高挂在淡蓝色的天空中，月光像流水一样泻下来，大地一片银白色。	0	-	1
7	她们俩在光明和快乐中飞走了，越飞越高，飞到那没有寒冷，没有饥饿，也没有痛苦的地方去了。	1	语文题库	1
0	threebody。	3	三体_刘慈欣	1
11	神七升天，不令我们中国人骄傲吗？	1	语文题库	1
0	人们在生活中常常有一种没有语言的语言。	3	平凡的世界_路遥	1
7	要做旗舰去长风破浪，要做火箭去推动飞船，要像利剑把贫穷斩断，要用爱心把世界相连。	1	语文题库	1
9	我常常想，不亲自站在群众的队伍里面是比不出自己高低的；我常常想，站在大洋的边岸上向远处放眼的时候，站在喜马拉雅山脚下向上抬头的时候，才会觉得自己的渺小。	2	伟大与渺小__臧克家	1
0	龙二成了这里的地主，常常穿着丝绸衣衫，右手拿着茶壶在田埂上走来走去，神气得很。	3	余华_活着	1
1	含羞草像一个害羞的姑娘，只要在它的叶片上轻轻一碰，它就合拢起来，枝条也跟着低垂下来，好像不敢见人似的。	0	-	1
5	黎明的鸡血红又热辣辣的在东方散发出奔放的晨光了。	0	-	1
0	那仆人也急了，走上前去说：长官，我是本县县太爷家里的。	3	余华_活着	1
1	在这场景前面，叠现着幽灵倒计时。	3	三体_刘慈欣	1
5	听一夜花开。	0	-	2
1	从耳机中听着来自宇宙没有生命的噪声，这嗓声隐隐约约的，好像比那些星星还永恒：有时又觉得那声音像大兴安岭的冬天里没完没了的寒风，让我感到很冷啊，那种孤独真是没法形容。	3	三体_刘慈欣	1
2	波浪一边歌唱，一边冲向高空去迎接那雷声。	0	-	1
1	年轻的红卫兵同她的旗帜一起从楼顶落下，她那轻盈的身体落得甚至比旗帜还慢，仿佛小鸟眷恋着天空。	3	三体_刘慈欣	1
4	危楼高百尺，手可摘星辰。	0	-	2
0	我们吃了几天生米，春生的脸都吃肿了。	3	余华_活着	1
2	小鸟在尽情歌唱。	1	语文题库	1
0	下面理解有误的一项是。	1	语文题库	1
8	寻寻觅觅，冷冷清清，凄凄惨惨戚戚.	2	-	2
0	你多次向学生散布反动的哥本哈根解释!	3	三体_刘慈欣	1
0	听我说．同志们，迟早都一样!	3	三体_刘慈欣	1
7	那连绵的山峰，像起伏的营帐；那蜿蜒的山峰，像雄伟的长城；那高耸的山峰，像伟岸的碉堡。	0	-	1
0	还是要小的？	3	余华_活着	1
0	做人呵，一旦嫖上以后，也就免不了要去赌。	3	余华_活着	1
1	她抡起皮带冲上去，她的三个小同志立刻跟上，叶哲泰的个子很高，这四个十四岁的女孩儿只能朝上抡皮带才能打到他那不肯低下的头，在开始的几下打击后，他头上能起一定保护作用的铁高帽被打掉了，接下来带铜扣的宽皮带如雨点般打在他的头上和身上——他终于倒下了，这鼓舞了小红卫兵们，她们更加投入地继续着这崇高的战斗，她们在为信念而战，为理想而战，她们为历史给予自己的光辉使命所陶醉，为自己的英勇而自豪……	3	三体_刘慈欣	1
0	古董的主人说：女人和小孩子懂什么？	2	把时间花在心灵上__林清玄	1
2	兴安岭多么会打扮自己呀：青松作衫，白桦为裙，还穿着绣花鞋。	1	语文题库	1
0	长期以来，我的作品都是源出于和现实的那一层紧张关系。	3	余华_活着	1
0	他们猜到我们有好吃的，都想来吃一口。	3	余华_活着	1
2	我说不清有一种怎样的感觉，虽然在学校里也偶然照照镜子的，却不知道自己是怎么个俊法；只有一点却明白不过，我这双熏染了墨馨书香的眼睛已变得过于苛刻了，几年少聚，总觉得姐姐身上少了些什么，是这明澈的眼睛太过坦白？	2	美丽人生_余志刚	1
4	她很快听到了另一种声音，一个低沉浑厚的嗡嗡声，浑厚而有力，似乎构成了整个世界的背景，这是不远处抛物面天线在风中的声音，只有到了跟前，才能真正感受到这张天网的巨大。	3	三体_刘慈欣	1
0	和他们的交往时，谈的都是一些很……	3	三体_刘慈欣	1
0	既没顺着山路走，他白天没有可以隐藏起来的机会；要打算白天也照样赶路的话，他必须使人相信他是个煤黑子。	3	骆驼祥子_老舍	1
1	地里的麦子，长得肥绿肥绿，风刮着，就像一湖绿水。	0	-	1
4	教室里安静得连掉下一根针都听得见。	1	语文题库	1
7	你心中渐渐滋生出怜悯，怜悯曾经沉溺的你，更怜悯你爱过的那人，怜悯那份庸常，还有那份虚弱。	2	爱情神话_斯好	1
8	想着想着，我的心里，好像有一颗种子在生根、发芽……	0	-	1
0	在逃去如飞的日子里，在千门万户的世界里的我能做些什么呢？	1	语文题库	1
1	一切只由他的话语建构起来，这鲨鱼齿一般前仆后继的、承诺之大厦啊！	3	房思琪的初恋乐园_林奕含	1
7	童年是一幅画，画出了我们的难忘时刻；童年是一本书，书里记载着我们的幸福时光；童年是一颗颗沙子，每一粒都是我们的回忆。	0	-	1
4	三年前，我十四岁的儿子遇到了车祸．我把孩子的肾捐给了一个患尿毒症的巴勒斯坦女孩，以此表达我对两个民族和平相处的愿望，为了这个愿望．我甚至可以献出自己的生命．而许许多多的以色列人和巴勒斯坦人也在做着和我一样的真诚努力。	3	三体_刘慈欣	1
0	说完丈人又转向我，喊道：凤霞就留给你们徐家，家珍肚里的孩子就是我们陈家的人啦。	3	余华_活着	1
2	当悲伤的水流入稳重的山，水这可怜儿的悲伤也勾起了山的悲伤，于是他们的心一起碎了。	0	-	1
0	中国画家为什么喜欢画竹子？	2	人生试金石_（8题）	1
0	我想起在青年时代，我的水缸也曾被人敲碎，我也曾被一起发过誓的人背叛，如今我已完全放下了诅咒与怨恨，只是在偶尔的情境下，还不免酸楚、心痛。	2	林清玄	1
2	我，要不断地与太阳赛跑！	2	林清玄	1
0	我就放学后不回家，偷偷藏在一个地方看闲书。	1	语文题库	1
1	这很容易使人回想起一个星星都没有出现时的苍穹，那蓝色的虚空透出一片广阔的茫然，仿佛是大理石雕像那没有瞳仁的眼睑。	3	三体_刘慈欣	1
9	很多事情我非常容易忘记。但也有些事情，尽管相隔数十年，还记得清清楚楚，每当回想起来仍如在眼前，好像最近遇到的事情一样。	0	-	1
2	我们在向晚的冷雨中飞离冬天的岛屿，你说：阳光在南中国海等待。	2	写给爱人的话_《台港文学选刊》	1
0	你们90后最喜欢的歌手是谁？	0	-	1
0	养成脑勤、手勤的习惯，凡是今天要办的事，决不拖到明天。	2	当你成了时间富翁以后_岑济鸣	1
1	士兵们枪上电筒的光柱集中在那个拿核弹的女孩儿身上，这个艳丽的死亡之花手捧着一千五百吨TNT．灿烂地笑着．仿佛是在舞台聚光灯下迎接着掌声和赞美。	3	三体_刘慈欣	1
0	这连超自然都不是，我都不知道是超什么了……	3	三体_刘慈欣	1
0	我是杨卫宁，基地的总工程师。	3	三体_刘慈欣	1
0	家珍要好好补一补。	3	余华_活着	1
1	里面有个胖胖的妓女很招我喜爱，她走路时两片大屁股就像挂在楼前的两只灯笼，晃来晃去。	3	余华_活着	1
4	一个人内心如果有了沉香，便能不畏惧浮世。	2	林清玄	1
0	炮弹在外面爆炸时常震得我们耳朵里嗡嗡乱叫，春生怎么说也只是个孩子，他迷迷糊糊睡着时，一颗炮弹飞到近处一炸，把他的身体都弹了起来，他被吵醒后怒气冲冲地站在坑道上，对前面的枪炮声大喊：你们他娘的轻一点，吵得老子都睡不着。	3	余华_活着	1
0	假如主人宣布，位置只有十二个，客人却有十四位，那便没有让座之事了。	2	话说谦让__梁实秋	1
0	一艘渔船正顺着波浪在海岸不远处载沉载浮。	2	林清玄	1
1	风起的时候，布条会油油招摇，像广告纸下边联络电话切成待撕下的细长条子。	3	房思琪的初恋乐园_林奕含	1
8	什么也不行，什么也不会，自己只是个傻大黑粗的废物！	3	骆驼祥子_老舍	1
0	手脚一出血，可把我娘心疼坏了，扭着小脚跑过来，捏一块烂泥巴堵住出血的地方，嘴里一个劲儿地数落我，一说得说半晌，我还不能回嘴，要不她眼泪都会掉出来。	3	余华_活着	1
7	那洁白的云朵，是蓝天的妆容；那灿烂的晚霞，是蓝天的笑靥；那横跨的彩虹，是蓝天的围巾；那飞翔的鸟儿，是蓝天的孩子。	0	-	1
0	屋里安静下来，只有钢笔尖在纸上划动的沙沙声。	3	三体_刘慈欣	1
11	你管他们，谁管你呢？	3	骆驼祥子_老舍	1
3	你们家有几个袁世凯？	0	-	1
7	童年就是生活的一杯美酒，童年就是甜蜜的梦想，童年就是我们将来的梦想！	0	-	1
0	家珍扭头看看我，走到轿子旁又回头看了看我，再看看我娘，钻进了轿子。	3	余华_活着	1
0	高架绞车松开了将摆锤拉向高处的细缆，巨大的摆锤沿着一条平滑的弧形轨迹无声地滑落下来，开始落得很慢，但迅速加速，到达最低点时速度达到最大，冲破空气发出了浑厚的风声，当这声音消失时，摆锤已沿着同样的弧形轨迹升到了同祥的高度，停滞片刻后开始了新一轮的摆动。	3	三体_刘慈欣	1
7	我爱小草的芬芳清香，我爱小草的青绿颜色，更爱小草顽强的生命力！	0	-	1
10	你考的真好啊，都到我的最差成绩了。	0	-	2
9	开国的人都是严肃认真的，败国的人和亡国的人都是不严肃的。	2	一年有半_吴	1
0	现在是躲在乡下，教着几个小学生糊口。	0	-	1
2	叶文洁看到，山下的森林．每天都在被她昔日的战友疯狂砍伐．荒地面积日益扩大．仿佛是大兴安岭被剥去皮肤的部分．当这些区域连成一片后．那幸存的几片林木倒显得不正常了。	3	三体_刘慈欣	1
0	叶文洁彻底无语了。	3	三体_刘慈欣	1
0	后来我干脆赊帐，债主们都知道我的家境，让我赊帐。	3	余华_活着	1
0	那些老先生、老太太唱歌的声音与神情深深地打动了我。	2	林清玄	1
0	我明白了家珍的意思，她是在开导我：女人看上去各不相同，到下面都是一样的。	3	余华_活着	1
3	时局动荡，烽烟四起，你们安分点儿呆在家里，哪都不要去。	0	-	1
9	也娶妻生子，治学问教书，做官开会，然而精神状态上始终是个阉人。	2	生命__沈从文	1
0	在城市边缘的那所著名大学的操场上，一场几千人参加的批斗会已经进行了近两个小时。	3	三体_刘慈欣	1
11	啊，难道人的审美天性与鸽子的灵气会产生同感？	2	信鸽_阿苇	1
5	你笑的很甜。	0	-	2
1	从巍峨峻拔的高原走来，我是冰山上的一朵雪莲。	1	语文题库	1
0	他们不需要学更多的东西了吗？	3	三体_刘慈欣	1
2	轻风扶细柳，淡月失梅花。	1	语文题库	1
0	我说：你来干什么，还不快给我回去。	3	余华_活着	1
0	我们那些江东子弟兵是顶聪明的。	0	-	1
1	天上的云彩，有的像山峰，有的像奔马，有的像狮子，形态万千，颜色各异，好看极了！	0	-	1
7	还会造成神经功能失调，扰乱肌体的自然平衡，引起头晕目眩、烦躁不安、食欲下降及乏力、失眠等症状，损害身心健康。	2	光明杀手_小百科	1
0	四外由一致的漆黑，渐渐能分出深浅，虽然还辨不出颜色，可是田亩远树已都在普遍的灰暗中有了形状。	3	骆驼祥子_老舍	1
2	纣王问，火光在他的双眸中跳动。	3	三体_刘慈欣	1
2	桃树、杏树、梨树，你不让我，我不让你，都开满了花赶趟儿。	1	语文题库	1
0	那斗落了大腿的蟋蟀，还想用那些小腿儿爬。	3	骆驼祥子_老舍	1
0	让我们在每一个相会，每一个因缘里，都能全心地付出与融人，都能无私地感谢和奉献。	2	林清玄	1
0	尤其是有关乎性的道德。	2	生命__沈从文	1
6	操千曲而后晓声，观千剑而后识器。	1	语文题库	1
0	我穿着白色的丝绸衣衫，头发抹得光滑透亮，往镜子前一站，我看到自己满脑袋的黑油漆，一副有钱人的样子。	3	余华_活着	1
0	被包围以后，我们的粮食和弹药全靠空投。	3	余华_活着	1
0	哦，这有没什么可奇怪的，在银河系的大片区域，恒星的密度十分均匀，这是星群引力漫长调节的结果。	3	三体_刘慈欣	1
0	几秒钟后，数字闪动了几下，消失了。	3	三体_刘慈欣	1
0	没有有庆去割草，两头羊就得饿死。	3	余华_活着	1
1	当汪淼的眼睛适应了这一切后，他看到了天空的红光背景在微微闪动，整个太空成一个整体在同步闪烁，仿佛整个宇宙只是一盏风中的孤灯。	3	三体_刘慈欣	1
6	横眉冷对千夫指，俯首甘为孺子牛。	0	-	1
10	真有意思，这里又可以唱歌，又可以跳舞。开联欢会，还有人架上机枪，保卫我们的安全咧！	0	-	1
0	还是慎重些吧，你想清楚这意味着什么。	3	三体_刘慈欣	1
1	那每一个人面、每一朵桃花，都是回不去的年华啊！	2	林清玄	1
3	竹竿轻飘飘地举起两根手指，晃了晃。	0	-	1
0	我爹拿着地契和房契连连咳嗽着走出来，他把房地契递过去，向那人哈哈腰说：辛苦啦。	3	余华_活着	1
0	就是，宇宙3K微波背景辐射整体上的各向同性的波动，振幅在百分之一至百分之五之间。	3	三体_刘慈欣	1
1	大漠沙如雪，燕山月似钩。	1	语文题库	1
1	刚刚被烧灼过的大地在夜色下发着暗红色的光，像一块从炉中夹出来不久的炭块。	3	三体_刘慈欣	1
0	有人来劫营了么？	0	-	1
9	你看看你的同桌小明，成绩优秀，安静乖巧；你再看看你，不学无术，胡作非为。	0	-	1
0	它是一个四维的巨人，我们的世界是一张三维的薄纸，它始在这张纸上，我们只能看到它的脚底与纸相接触的部分。	3	三体_刘慈欣	1
11	班主任难道不应该以身作则吗？	0	-	1
4	欢蹦乱跳的牲口，一夏天在这儿，准教苍蝇蚊子给拿个半死！	3	骆驼祥子_老舍	1
5	你今天的穿搭真是好看极了，活脱脱一个日系甜甜美少女。	0	-	1
0	家珍又扯了扯我的衣服，我一看，她又跪到地上。	3	余华_活着	1
1	三天后，也就是十四日，在凌晨一点钟至五点钟，整个宇宙将为你闪烁。	3	三体_刘慈欣	1
4	这意味着漫长的严寒岁月，冷得能把石头冻成粉末。	3	三体_刘慈欣	1
4	畅游在这样的山水间，把世界上的一切都忘记了。	1	语文题库	1
11	难道不是吗？	0	-	1
0	潘寒愣了一下．过了这一关似乎并没有让他松一口气：我……	3	三体_刘慈欣	1
0	她蹦蹦跳跳走过来，扑到我腿上问我：为什么他们说我不是小姐了？	3	余华_活着	1
11	这世界上除了人之外难道真的还有什么东西会计算吗？	3	三体_刘慈欣	1
9	松鼠的叫声很响亮，比黄鼠狼的叫声还有尖些。	0	-	1
0	我想爹你就进来吧，你就把我剁烂了吧。	3	余华_活着	1
1	想象一个古代的王国，他们的技术也在进步，能为士兵造出更好的刀啊剑啊长矛啊，甚至还有可能过出像机关枪那样连发的弓箭呢，但……	3	三体_刘慈欣	1
0	半个世纪后，历史学家们一致认为，l969年的这一事件是以后人类历史的一个转折点。	3	三体_刘慈欣	1
11	人难道可以长生不老吗？	0	-	1
2	见一淡绿百合花，颈弱而花柔，花身略有斑点青渍，倚立门边微微动摇。	2	生命__沈从文	1
6	千山鸟飞绝，万径人踪灭。	1	语文题库	1
5	夜晚的彩灯亮,这边红、那边绿,这边明、那边暗,整个城市奏响了一曲欢腾的乐曲.	0	-	2
4	在电梯里遇见钱一维，那沉默的空气可以扼死人。	3	房思琪的初恋乐园_林奕含	1
0	我那副模样让她信了，我娘一屁股坐到了地上，抹着眼泪说：上梁不正下梁歪啊。	3	余华_活着	1
9	我再好好一瞧，果然，它们比相思豆扁，颜色也更红。	2	此生温情这一刻_语文报	1
2	花微抖，如有所怯。	2	生命__沈从文	1
3	网上聊天的时候觉得她还不错，一见面我立马就甩掉了那只恐龙。	0	-	1
0	一个人如果能把诅咒，怨恨都放下，才会懂得真正的爱。	2	林清玄	1
0	到那时别说是养活一家人，就是龙二的租粮也交不起。	3	余华_活着	1
9	一棵林间的小树，有时比娇贵的兰花更令人动容。	2	林清玄	1
1	那溪水是那么清，溪水映着蓝天白云，仿佛又是一片天空。	0	-	1
0	尤其是发生在那个年代，更是传奇中的传奇。	3	三体_刘慈欣	1
0	您对女儿的教育真是成功。	3	三体_刘慈欣	1
0	那个老红卫兵最后的一句话在她脑海中不停地回响着……	3	三体_刘慈欣	1
11	一天十万字，你觉得可能吗？	0	-	2
0	我们说的是三颗太阳，不是两颗！	3	三体_刘慈欣	1
0	她穿着新衣服，喜气洋洋的上门来拜年。	0	-	1
0	重新查看每张底片，汪淼很快发现了这些数字的第一个诡异之处：它们自动适应背景。	3	三体_刘慈欣	1
8	终于自由啦!终于自由啦!感谢全能的上帝，我们终于自由啦!	0	-	1
9	有的人活着，他已经死了；有的人死了，他还活着。	0	-	1
6	没有阳光花儿不香，没有爱情生活不甜。	0	-	1
9	没有金字塔，没有联合国大厦，巨摆纪念碑也不知去向，只有黑乎乎的戈壁滩延伸到天际，与他第一次进入这个世界时一样。	3	三体_刘慈欣	1
7	哦，不，我失去的太多，我不敢求，我只求你还给我一片干净的水，给我鲜澄的湖，给我透明的溪涧，给我清澈的灌溉渠，给我浩淼无尘的汪洋！	2	给我一点水_张晓风	1
0	风、花、雪、月、梦的盘子，我每次看见，都仿佛有什么东西被唤醒，看了就有喜欢的心情。	2	林清玄	1
0	半迷糊中卧床上默想，觉得惆怅之至。	2	生命__沈从文	1
0	凤霞像是没有听到，倒是有庆转回身来看我，他被凤霞拉着还在走，脑袋朝我这里歪着。	3	余华_活着	1
0	谈起自己的经历来，他说他后来没有了学费，不能再留学，便回来了。	0	-	1
0	自从我赌博上以后，我倒还真想光耀祖宗了，想把我爹弄掉的一百多亩地挣回来。	3	余华_活着	1
1	排成长龙的车子一起跑了起来。	2	白色的帽子_　　前面是红灯，“的士”停了下来。	1
1	元首，谈何容易，我们与地球的联系细若游丝，八万多时才能完成一次应答。	3	三体_刘慈欣	1
0	会生活的人失去的多，得到的更多。	2	走进生活_吴善磊	1
4	桂子花开，十里飘香。	1	语文题库	1
0	八大山人的真迹我是第一次见到，你看那鸡的眼睛，八大山人画眼睛都仅仅是一个圈里一个点，世人要到了二十一世纪才明白，这比许多工笔画都来得逼真，你看现在苏富比的拍卖价，所以我说观察的本事嘛！	3	房思琪的初恋乐园_林奕含	1
7	两双明亮的眼睛，两颗狂跳的心，两片火热的嘴唇。	2	羞死鸟_　　只能闻到它声息，却看不到它的踪迹。	1
0	他垂着双手，低头走入了前面的浓烟。	3	余华_活着	1
11	敢于这样做的人，难道不是一个英雄吗？	0	-	1
0	按我们这里的习俗，家珍是被她娘家的人硬给接走的，也应该由她娘家的人送回来。	3	余华_活着	1
2	天空的星星快活地眨着眼睛。	1	语文题库	1
3	我怎么可能和那个麻子交往？	0	-	1
1	家就像大衣一件,不会提高温度,但却给予人们连火炉都不能替代的温暖。	0	-	1
0	我走近一个村子时，常会听到孩子的喊叫：那个老打呵欠的人又来啦。	3	余华_活着	1
8	在我的后园，可以看见墙外有两棵树，一株是枣树，还有一株是枣树。	0	-	1
1	但进一步细看时，他发现，这个太阳与自己现实经验中的那个有些不同，它有一颗很小的核心，如果将太阳看成一只眸子，这个日核就像瞳孔。	3	三体_刘慈欣	1
1	像芥茉，也像菜籽。	3	白鹿原_陈忠实	1
8	是，是，连长，我是县太爷的仆人。	3	余华_活着	1
0	家珍还是说：你跟我回去。	3	余华_活着	1
1	这时，早晨从太平洋东海岸升起的太阳正向太平洋西海岸落下，运河中金光粼粼，更近的下方，死亡之琴静静地立着，两根钢柱黑乎乎的，反射不出一点儿阳光，看上去比流过它们中间的运河更古老。	3	三体_刘慈欣	1
6	手持一书，吟哦于四壁之中，神游于四海之外，既可以与老庄谈心，又可以跟柏拉图对话。	2	熊家的儿子_金圣华	1
7	有的荷花含笑伫立；有的荷花舒展怒放，白里透红的花瓣，金黄色的花蕊，有的荷花是纯白色的，却滴尘不染。	0	-	1
0	对待我们的生命与情爱也是这样的，时时准备受苦，不是期待苦瓜变甜，而是真正认识那苦的滋味，才是有智慧的态度。	2	林清玄	1
0	家珍是在有庆半岁的时候回来的。	3	余华_活着	1
0	淆草花庄，像沟坪都已在时光中逸去，将来只成为一些片断的记忆，甚至不会有人知道这两个地名。	2	林清玄	1
